,id,genre_ids,title,overview,poster_path
1047,309126,[80],Eenadu,"Eenadu is Krishna's 200th movie with huge star cast.  It's almost on the same lines of his 100th movie ALLURI SEETHA RAMARAJU.  But in this movie, he fights against the politicians and industrialists who are looting the poor, the movie is about Ramaraju (Krishna) a social reformer who fights against the injustice by the political system and stands in support to the poor and down-trodden.Kantha Rao, Jaggayya, Rao Gopal Rao played the villains in the movie. Rao Gopal Rao is a small-time politician and brother-in-law of Krishna and husband of Krishna Kumari. His brother-in-law being a selfish and cruel man, Krishna stays away from them. Jaggayya is a businessman and and old friend of Krishna because of him Krishna lands in Jail without a fault of his. Kantha Rao is a criminal and after coming out of Jail, he enters into politics and becomes a minister.These three create havoc and play with the lives of the poor.",
1048,200402,"[18, 27]",Prema Katha Chitram,Four youngsters upset with their lives plan to kill themselves in a farmhouse where they experience paranormal activities.,/7m8mNU3EyW7Mc2uS5fIkzjmA76R.jpg
1049,476118,"[10749, 35]",Ungarala Rambabu,"A man has to prove his worth to the father of the woman he loves. What happens when capitalist and communist ideologies collide, will Rambabu be able to achieve what he set out for?",/nUO5jIslzaJMtylPCu2dmXaP1KO.jpg
1050,468836,"[10751, 18, 10749]",Vaisakham,"Venu lives in an apartment and he does not give respect to the elders.  One day he meets Bhanu who is a beautician. She always gives importance to family values. She has a fixed opinion on things, and yet she is slightly shy. As expected,  both Venu and Bhanu initially indulge in fights initially and slowly he falls for Bhanu but when he proposes Bhanu, she turns down Venu’s proposal.  What will happen now? What about Venu’s family?",/70Vr5hOm6lHLAOSUCVqHV5k8MZc.jpg
1051,457650,"[80, 53, 18]",Venkatapuram,"A happy-go-lucky Anand unexpectedly meets a young girl and lands himself in a murder case. With no connection to the murder, Anand is unnecessarily linked to the case, following which he attempts to prove his innocence and unravel the mystery behind the murder.",/A5aRauFVQRLk2j6eSjCmSbggDBQ.jpg
1052,400721,"[35, 53]",Lacchimdeviki O Lekkundi,"Devi works in a bank as cashier, and is very smart. Naveen works in the same bank at the help desk and likes her. Naveen wants to become rich in life and agrees to a gang’s plan to steal the data of unclaimed accounts. Apart from the Bank’s manager, only Devi has access to this data. He impresses her and gets close to her. One day he steals the data and hands it over to the gang headed by Mahesh. Using the details in the data, Mahesh wants to claim them. Rest of the story is how Naveen manages to escape from this trap and saves the money along with Devi.",
1053,300752,[],Oka Criminal Premakatha,"Crime drama staring Manoj Nandam, Priyanka Pallavi and Satyanand",
1054,279300,[18],Rakshasudu,"Pursha is searching for his mother. He meets JK, who has the information on his mother but he first wants Pursha to finish off his rivals. In his quest, he meets Sumatri and then comes up with a plan.",/y8rDuM7FZjdS7yokP3FOr87cXJU.jpg
1055,81898,"[35, 10749]",Prayanam,"This is a story of a boy and girl who meet for the first time in an airport and fall in love before they board their respective flights. Dhruv is the boy and Harika is the girl. Both of them are two distinctive individuals. Dhruv is a kind of boy who loves to take chances in life. Harika is the one who likes to make right choices in life, She is doing Masters in Lifestyles Design Academy in Malaysia. Right now she is on her way to INDIA to meet a prospective groom whom her parents have chosen for her. Dhruv falls in love at first sight with Harika when he sees her in airport. But he has only two hours to make her fall in love with him. The rest of the story is all about how he succeeds in it.",/jN79UzRtaTNdnGVjKf3BZfxZ8od.jpg
1056,675970,"[28, 18]",Eduruleni Manishi,,
1057,308208,[18],Amma Rajinama,Bollywood 1991,/gccRNehTT0LRCrkZFUirTFySeVS.jpg
1058,226292,[],All the Best,Ravi desperately needs money to bail out his father who has been wrongly accused and jailed. He becomes a con artist but keeps getting into trouble. Chandu saves him and they become partners in crime.,/az0hP1o3HXgyiEVZ4Wgr11PTsgI.jpg
1059,677096,"[35, 18]",Pressure Cooker,"This is a new age family drama entertainer. The story is about a young graduate under pressure from his father who expects him to go and ""settle"" in USA to be seen as successful. #pressurecookermovie",/lbkEA6BFS1nW8VR0xmaK3EG6Z52.jpg
1060,528917,[35],Appu Chesi Pappu Koodu,The film deals with how the middle-class families are getting cheated in the hands of gullible people.,
1061,330767,[],Lakshmi Putrudu,Lakshmi Putrudu is a 2008 Telugu drama film.,
1062,307403,"[12, 18]",Chandirani,"When Prachandudu kills Chandirani's mother and imprisons her father who is a king, she decides to eliminate him to avenge her mother's death and to save the people of the kingdom too.",/ySaGgaP8oIuMbvjkfMup2fcvR9e.jpg
1063,280341,[18],Krishna Babu,"Krishna Babu is a action oriented movie in which Krishna Babu (Balakrishna) is the man of jamindar clan in Krishnapuram, who is considered as the most important man in that village. Vijay Babu (Abbas) is his brother doing his graduation in Hyderabad. Chandra Babu (Chandra Mohan) is the maternal uncle of KrishnaBabu who stays along with him to take care of him. Krishna Babu meets the sensuous damsel Rama (Meena), the daughter of the new head master. Rama and KrishnaBabu fall in love over the period of time. Meantime Vijay Babu is in love till his neck with his classmate Shilpa (Raasi) in Hyderabad. Rama and KrishnaBabu are all set to get engaged to each other.Rest of the story is about how all ends well.",/8xioWW8353blmY1pHWfMpJqmbzB.jpg
1064,1032920,[],Lady Tarzan,"Raghu, a business tycoon, is driving through a forest with scenic views with Rani, his preteen daughter, when they are suddenly stopped and attacked by a group of thugs. They start hitting Raghu and, when the child interferes, one of them grabs her and throws her over his head to a certain death in the deep river and waterfalls below. Surprisingly, the girl survives the fall and, with the help of wild animals, grows up healthy and athletic as Lady Tarzan. Her parents are doing their best to find her...",/43QCrt30V5ODcPYecVQ5qa98a0g.jpg
1065,995454,[18],Ramudu Kadu Rakshasudu,,
1066,860734,[35],Bandhuvulostunnaru Jagratha,"Chittibabu, an orphan, longs to have a family of his own. Shortly after getting married, he tires of his overbearing relatives and tries to find a way to rid himself of them.",/wwSOfDIZ5D5XJTw6aNgIwqMr1QK.jpg
1067,765935,[18],Vendi Thera,"Vendi Thera is  a 1995 telugu movie starring Sai Kiran, Vasantha, Priya and Rajasekhar in the lead roles.",
1068,325184,"[18, 10402]",Kokilamma,Kokilamma is a 1983 Telugu film directed by K. Balachander. The title role of Kokilamma is played with humility by Saritha. It is a musical hit film with some excellent songs penned Acharya Atreya and music score provided by M. S. Viswanathan. The Andhra Pradesh Government has also awarded K. Balachander the Nandi Award for Best Screenplay Writer for his film Kokilamma in 1982.,
1069,322265,"[10751, 10402, 18, 10749]",Pelli Sandadi,A musician finds the love of his life whom he saw in a dream but his marriage has already been arranged to another girl.,/tz0P2cC7NYndh3YcFtA0u4nBgkb.jpg
1070,279127,"[18, 28, 80]",State Rowdy,"An aspiring police officer changes the course of his life when he is unable to achieve his dream due to dirty politics. Then, he turns into an outlaw and decides to eliminate crime on his own.",/AwlOFa2CPWnumr9zcLbaUQfZBJy.jpg
1071,610096,"[53, 28, 80]",Kalki,A police officer gets assigned to investigate a crime scene in a town and finds out about a chain of crimes surrounding it. He begins digging deeper and finds out there’s more to it than what’s on surface.,/jsinmhbkmRLhu2d6IDkkVuv8RGC.jpg
1072,108340,"[28, 18, 80]",Bejawada,"A fearless young man sets out to avenge his brother's death by eliminating the devious criminals responsible for the murder. In the process, he must also fight for justice and save the labourers' and students' unions from the gangster's ruthless tyranny. Will he succeed in his mission?",/1TuxyXuwq2ns10ZXhRENhUfAeKS.jpg
1073,199800,"[28, 80]",Komaram Puli,Puli joins the police force since he wants to avenge his father's murder at the hands of Al Saleem. He gets an opportunity to bring Al Saleem to justice after he saves the life of the PM of India.,/pLXXbWe1rucLaxMFRCAwe1dBxon.jpg
1074,312324,[35],Joru,"Sundeep, a youngster from Vizag, meets Anu, a NRI girl who comes to India to meet her father, and falls in love with her. Soon, he realises that Anu’s life is in danger. How he sets everything right forms the rest of the story.",/wyZ2TcImMM6a0FGbnRmSuh6zmgT.jpg
1075,38887,"[18, 53, 10749]",Anaganaga Oka Roju,Two runaway lovers are wanted by the police and a bunch of crooks. Unknown to them they carry a powerful evidence that can expose a dirty political plot. The only person who can help them is a thief who himself is wanted by the police.,/ingp6akXZeztYGveQzzeUcApZ1F.jpg
1076,80944,[],Bhairava Dweepam,"Bhairava Dweepam (Telugu: భైరవ ద్వీపం) is a very successful Tollywood folk movie that was released by the banner of Chandamama Vijaya Combines in the year 1994. The movie was starred by Nandamuri Balakrishna, Roja Selvamani, Rambha, Kaikala Satyanarayana, Manorama, K. R. Vijaya, Babu Mohan, Giri Babu, Subhalekha Sudhakar, B. Padmanabham, Vijayakumar, Suthi Velu and many more. Produced by B. Venkatarama Reddy, Music by Madhavapeddi Suresh, Story, Screenplay & Direction by Singeetam Srinivasa Rao.",/jblkkdIHjYKxMyVMjnwoHToBECz.jpg
1077,499373,"[10751, 10749, 35]",Rangula Ratnam,"Vishnu is a mama's boy, dependent on his widowed mother for everything. He falls in love with Keerthi the second he lays eyes on her. But what happens when his world is shaken apart? Can he cope and keep up with his love?",/zs2YBYd0IwPtEQYTkZQ5rcMliqO.jpg
1078,409197,[27],Deyyam,"Murali and Sindhu, bought a new farm house in the suburbs of Hyderabad. The problem comes when Sindhu's son starts making imaginary friends in their new home. It is later then revealed that his ""imaginary friends"" are ghosts and they have been telling their son to move out of their house.",/lzlk3QGkB7ngf5lCglL8v1Zxuw7.jpg
1079,681657,"[53, 10749]",O Pitta Katha,"O Pitta Katha is a Telugu movie released on 6 Mar, 2020. The movie is directed by Chandu Muddu and featured Viswant Duddumpudi, Brahmaji, Nithya Shetty and Sanjay Rao as lead characters.Other popular actors who were roped in for O Pitta Katha is",/hSNQs2DrKfbyUgmai4U2CvjZ4Y1.jpg
1080,279449,"[35, 10749, 14]",Gopala Gopala,"Gopala Rao, an atheist, finds himself in the midst of crises. When Govinda Hari enters his home, Rao's life changes in miraculous ways.",/yDPXdJIuMQNo1kzdWyQUjKzxl4i.jpg
1081,889057,"[28, 80, 10749]",Arjuna Phalguna,"Arjun, an unemployed youngster, with his friends plan to start a soda factory, but a lack of money hinders their plans. By taking smuggling route, they agree to transport Ganja as a quick route to earn money and land in a mess. A cat and mouse game between the police and the friends begin.",/kBkfc0MxqIUbAp9kUHLDUk3H7ZY.jpg
1082,204395,"[28, 10749, 10751]",Tadakha,"A gentle and introverted young man is given employment in the police department, when his father, an inspector, dies of a sudden heart attack. In the line of duty, when he earns the wrath of a dangerous gangster, he and his brother must fight to defeat their powerful enemy. Will they succeed in doing so?",/oYktMhyBKv5KExqxy6rrwH5n5kJ.jpg
1083,260016,"[10749, 28, 18]",Sivamani,"Shivamani (Nagarjuna) is a honest cop in Vizag. He falls in love with Vasantha (Asin), a beautiful lady who aspires to become a singer. There is a mafia guy called Dutt (Prakash Raj), whom Shivamani troubles a lot. Incidentally Vasantha is distantly related to Dutt and both of them belongs to Kerala. In the meantime, Shivamani's mother (Sangeeta) gets paralyzed. Shivamani and Vasantha take her to Kerala to get the treatment of Kerala's Ayurveda specialists. In the process, Dutt gets back to Kerala and he is on the mission to weaken Shivamani by getting Vasantha away from him. The rest of the story is all about how he gets back Vasantha with the help of a newspaper's editor Pallavi (Rakshita).",
1084,803852,"[53, 80]",Climax,"Vijay Modi, a flamboyant billionaire. He lives a luxurious lifestyle surrounded by beautiful women and enjoys every bit to the core. Despite having it all, he wants to fulfill his three desires in life - to earn popularity, make a movie and become a successful politician. Proceedings turn interesting towards the latter part of the promo where cops enter into the scene and what unfolds next forms the crux of the plot.",/l2xR8AHcGJc6kIhVoXquYE24f8F.jpg
1085,307614,"[28, 35]",Rabhasa,"US return student Karthik pledges to marry his uncle Dhanunjay's daughter Indu, which was his mother's wish. A small family feud ends with both the families getting separated. He joins Indu's college to convince her to marry him, but mistakenly assumes Bhagyam as Dhanunjay's daughter. Later, Karthik realizes that Indu is his cousin but she is already in love with another guy. He gets entangled in a risky situation when he tries to help a stranger. The rest of the story is all about how he controls the damage and fulfills the wish of his mother.",/fMiG03i11lQ5E3Q0HWMnuemr59p.jpg
1086,279484,[10749],Super Police,"Super Police is a 1994 Telugu film directed by K Murali Mohan Rao. The film stars Venkatesh, Soundarya, Nagma and Brahmanandam in lead roles.",/bEDcJzX4iasuTjiJRhA1TE167gu.jpg
1087,331939,[28],Current Theega,"Shiva Rama Raju, a noted good Samaritan in Parvatipuram who has a bet with Veerraju in the same village that ""if any of his 3 daughters fall in love he will either kill them or cut down his ears"" and he takes a vow that he will marry off his daughters to the grooms of his choice, neither love marriage nor elopement. Kavita is his third daughter. Raju is a wayward youth who is in deeply in love with an English teacher Sunny in a junior college. Kavita is one of Sunny's students. Raju uses Kavita as courier to love Sunny; as the things proceed, Raju and Kavita fall in love. The rest of the story is all about what happens when they want to get married.",/fvC2s9G14sPEsHuDQE8S1VWAFSx.jpg
1088,180736,"[35, 18]",Appula Appa Rao,"Appula Appa Rao  is an Indian 1991 Telugu-language film directed by E.V.V. Satyanarayana which features Rajendra Prasad, Shobana and Brahmanandam in the lead roles. Appula Apparao is scripted and directed by E.V.V under the banner of Prasad Studios, Chennai and produced by E.V.V. Satyanarayana.",/4onQu9UVp5q5mfzfnxiZ7v0jO06.jpg
1089,1061647,"[10749, 35]",Valliddari Madhya,"A love story between a conservative man and a modern woman. Upon meeting an invisible guest from an unexpected place, the story takes you on a fun-filled emotional roller coaster ride.",/1WQMBdosnbKpa0g3IrHjxUsOIyh.jpg
1090,459803,[35],Babu Baga Busy,A man's sexual affairs with different woman in different stages of life comes to an end when he meets a girl accidentally.,/t3zQi6ShP0AA9g2lXE7bWqFkxxY.jpg
1091,180638,[],Aapathbandavudu,"Aapadbandhavudu is a 1992 Telugu film. It was the third collaboration between actor Chiranjeevi and director K. Viswanath after Shubhalekha and Swayamkrushi. The movie won critical acclaim, especially for Chiranjeevi, who received the Nandi Award for Best Actor & Filmfare Award for Best Actor - Telugu for his performance. This film marked Jandhyala's only screen appearance.",/pNFp5IqL222JNootpCoOQF4IlP9.jpg
1092,155719,[],Srimannarayana,"Srimannarayana is a 2012 Telugu film directed by Ravi Chavali. The film is produced by Ramesh Puppala under his Yellow Flowers banner.It stars Nandamuri Balakrishna, Parvati Melton and Isha Chawla in the lead roles",/zW1i3xEBv9oCYV56EGUjoKZuG69.jpg
1093,23773,"[28, 10749]",Rechipo,Siva (Nitin) is a thief. He robs the Peter to pay Paul on the lines of Robin hood. He always robs the black money from rich persons and spends it for the education of orphans and for a good cause. Siva robs Rs 500 crores from the Home Minister's house. While escaping under disguise he meets Krishnaveni (Ileana) and both fall in love. The rest of the story takes twists and turns where Krishnaveni is kidnapped by the mafia later to be saved by Siva.,
1094,199994,"[18, 35]",Sarocharu,"Sandhya (Kajal Aggarwal) is a student who is madly in love with Karthik (Ravi Teja), a techie based in Italy. She decides to travel with him to India, confident that the travel time would be enough for her to get Karthik to fall in love. Karthik reciprocates her gestures in a friendly way, but finally reveals that he is married to Vasudha (Richa Gangopadhyay) but is waiting to seek Divorce.",/1GUMmBWpcQDPjptGdlnfsPwPx2K.jpg
1095,578060,[28],Vikram,"Vikram is a 1986 Telugu film directed by V. Madhusudhana Rao, produced by Akkineni Venkat under the Annapurna Studios banner. Akkineni Nagarjuna and Sobhana played the lead roles and the music was composed by Chakravarthy. The film was a remake of the Hindi film Hero (1983) and it is the first debut of Akkineni Nagarjuna as a hero. The film was recorded as a Hit at the box office.",/d489L1rjwHdUQLt8kGLocj2zlyh.jpg
1096,726027,[18],Sreekaram,"Karthik hails from Rayalaseema and is doing well in his career as a project lead in an IT company. Wanting to pursue the family’s vocation of farming, he quits his job and returns back to his village. Will he be able to bring back lost glory to the profession?",/3csTaJ5fZ0XyCegpGP3MjmGieWI.jpg
1097,1095565,[53],Maataraani Mounamidhi,Ram's active visit to his nephew Eswar's place turns into thrilling and scary incidents which no one ever witnessed or experienced. The endearing screenplay and enlightening twists will make you sit edge of the seat.,
1098,600650,[],Where Is The Venkatalakshmi,"Chantigadu and Pandugadu are two good-for-nothing moral-less individuals who love to make life a living hell for everyone in their village, especially the women. But their life changes once Venkatalakshmi  comes to their village.",/4WKp6uOnXbAUhsSclm9occVgY1r.jpg
1099,81050,"[35, 10749]",Ganesh,"In order to help a friend, Ganesh pretends to love a girl. She hates him when she finds out the truth. Eventually, he truly falls in love with her and must convince her of his true feelings.",/hXCB8l0eKgnl1aypSQ7rlmeX8ZY.jpg
1100,315170,[28],Mukunda,"Set in a small town in Andhra Pradesh, the film revolves around a youngster, Mukunda, who challenges the domination of the Municipal Chairman and the rest of the story is about how he ends up inspiring everyone around him.",/fsCah4lXNUl3YjuGfdWNFt4JXhi.jpg
1101,117092,"[18, 10749]",Gangotri,"A factional leader's only daughter falls in love with his loyal lieutenant's son. When the childhood lovers' secret is exposed their fathers become enemies. How will the young man react to his lover's father bombing his house? Will there ever be an end to the cycle of violence, hatred and revenge?",/eb3jtjz84n8k0MHr6pYvwfaieQ3.jpg
1102,307751,[],Brother of Bommali,"Twin siblings Lakshmi and Ramu have contrastive personalities. Ramu is tender-hearted and ready to compromise on any issue at home. Lakshmi, however, is rebellious and grows up to be tomboyish. Ramu falls in love with a girl and wants to get married to her. When his family rejects his decision and want their daughter to marry first, Ramu sets on a mission to unite his twin with her love.",/mQl6gW80AbcJDRQHjE23Lo6BdtZ.jpg
1103,261568,"[10749, 35]",Gharana Bullodu,Raja is a tonga driver who fights for the downtrodden while Ammaji is an ambitious politician. He enters her house as her grandson-in-law to fight for justice and end her tyranny.,
1104,228096,[],Adavi Ramudu,"Madhu comes to a village in childhood here she taught a boy and tells him to be educated person.10 years later the boy Ramadu(Prabhas) returns to the college,here he meets college most wanted sexiest woman Madhu(Aarthi Aggarwal).Madhu gots into love with him.Later she reveals in her birthday party that she was the childhood girl who told him to be educated person.However Madhu mother Tribhuvna(Telangana Shakuntala) insults him and through out of her party and house.Tribhuvna is a hot minded woman who can do whatever she wants either Mafia or Politics.She want kill ramadu.What happens then is rest of movie",/hyFMf4CVCfxUfSqW788j6nQR9Lq.jpg
1105,1063004,[18],Police Bharya,"A police officer and his wife exploit his junior officer and his wife. Enraged, the junior officer's wife vows revenge and decides to teach them a lesson.",
1106,348655,[28],Lion,"He (Balakrishna Nandamuri) gets injured and goes into coma at a hospital in Mumbai. When he wakes up he vaguely remembers what happened to him. He remembers himself as Bose. But, he is identified as Godse, CEO of a company in Mumbai. As he is having memory issues, he goes to Hyderabad to search for his past. He finds his parents and his lover. But they deny him. Are they his real parents or is it just a feeling of deja vu? Rest of the story is all about what led to his injury and how he fights his way back!",/rVdFt8nNZegUcP7Jxl6Yk6yuzux.jpg
1107,857832,"[35, 18, 10749]",SR Kalyanamandapam,"The plot revolves around a family that owns SR Kalyanamandapam, where marriages are conducted from ages. Dharma (the father) fails to take care of the business. Unknown Conflicts occur between the father and the son. Kalyan comes to restore his family’s pride, falls in love with Sindhu. How does Kalyan settle the issues and solve the conflicts?",/oSmKT6NrV64MBLLU6y1775lT9kb.jpg
1108,137273,[],Mahatma,"Dasu (Srikanth) is a rowdy in a basti in Hyderabad. He makes a living out of ""settlement of petty issues"". A young lawyer Krishnaveni (Bhavana) gets him bail in a petty case and their acquaintance soon develop into romance after a series of events. On other hand, a politician cum business woman (Jyothy) plans to set up SEZ in that basti that move is protested by dwellers headed by a genuine leader (Sekhar). Meanwhile, a local politician cum rowdy leader Dada (Jayaprakash Reddy) also protests against businesswoman and seeks Rs 200 Crores from if she wants to set up SEZ there. Dasu initially believes Dada as good politician and works for him. When Dada tries to take advantage of Dasu, he realizes his fault and plans to contest against him on a newly floated Mahatma party. How Krishnavani and local theatre artiste bring change in Dasu and make him realize the importance of Mahatma Gandhi's ideology is core point of the movie.",/iSOuXs1l6ImvsRTQoFiNxkv9oI4.jpg
1109,81997,"[28, 10749]",Vinayakudu,"Karthik (Krishnudu), the obese guy joins in an ad designing company. Girls tend to keep him away from them due to his odd personality. He finds a girl Kalpana (Sonia) interesting in that company. She too shuns him initially and also cracks lots of jokes on his physical appearance. But the soft hearted Karthik wins the heart of arrogant Kalpana with his immaculate attitude. Finally, the egoistic Kalpana falls in love with Karthik unknowingly. On the other hand, the love track of Sandhya (Poonam) and Altaf (Surya Tej) runs separately. Shalini (Ankitha) is a character that's used as catalyst to elevate the character of Karthik.",/on0d7AXPtqPH0dB2U0rmoJYEO6c.jpg
1110,500189,"[18, 10751]",Sneham Kosam,"Prabhavati lives a wealthy lifestyle in India with her dad, mom, and elder sister, Rani. Rani is of marriageable age and her marriage is arranged with her mom's half-brother, but just after the marriage one of their servants, Sheroo, a close friend of her dad's, kills her mother, is arrested by the Police, tried in Court, and sentenced to 15 years in jail. Since that day relations have been strained between her dad, Rani, and her husband. She re-locates to U.S.A. to study, and when she returns she finds that Sheroo's has been replaced by his son, Veeru, and runs their household, while there has been no improvement in the relationship between her dad and Rani and her family, which also includes, Veena, Rani's daughter. Prabhavati attempts to bridge the misunderstandings between her dad and sister, but to no avail, and when she proposes to get married to Rani's nephew, Ranjeet, her father opposes this tooth and nail. Then Sheroo is discharged from prison and returns home to find that ...",/8CJ1YQ7772C0GObelY5pYAp8MCy.jpg
1111,770391,"[28, 18, 878]",Bombhaat,"Vicky is a man who’s brought up being told by his parents he’s the unluckiest fellow on earth. His girlfriend Chaitra  goes against the world and even her own father to prove him wrong. Life goes for a toss, more than usual, when he rescues his mentor’s daughter Maya.",/jMsXPRbjltXy4Hu4H6Rt4rBBngs.jpg
1112,826694,[],Shukra,A couple enters a city ruled by cruel thugs but an unsettling affair reopens unexpected twists and creates new tensions for them. Will they stick together through it all?,/fkqwXMuIO7OEoYrZG0G9IydCb9.jpg
1113,80924,[28],Bhadra,Bhadra(Telugu: భద్ర) is a Telugu film released on 12 May 2005 ( Dubbed in malayalam as Brahmam ) and was directed by debutant director Boyapati Srinu. Ravi Teja and Meera Jasmine played the lead roles. The film was later remade into Tamil as Saravana with Silambarasan and Jyothikaand also remade into bengali as Josh with Jeet and Srabonti. Linda Arsenio danced in an item number.,/qTmrIMasYlmNKRC2ro6trZnVWUs.jpg
