,id,genre_ids,title,overview,poster_path
546,411601,[],Srirastu Subhamastu,"Sirish belongs to a well to do family which is headed by Prakash Raj. Things in his family get disturbed when Srirish’s brother loves and marries a middle class girl against his father’s will. In this crunch situation, Sirish falls in love with a yet another middle class girl called Anu(Lavanya) and reveals about this to his father. An upset Prakash Raj, gives him a piece of his advice and asks him to back off from the relationship. An adamant Sirish, challenges his father that he will win his love by not using his family name. In this process, he woos Anu and right when the time things start getting positive, Anu’s father arranges her marriage with some one else.Rest of the story is as to how Sirish manages to convince both Anu’s parents and his and finally comes out victorious.",/axZdNdOMuebewk7uapEgqYvfaKX.jpg
547,1092632,"[35, 18]",Balagam,"A boisterous, bawdy, meddling village patriarch Komurayya’s death just before the engagement changes the course of  his grandson Saayilu's life and the other family members, rattling some skeletons in the closet, exposing the rifts present within the family, causing bigger sociological calamities in the small village.",/m5Wtp4BcMm6Z03rjik11AS5UYhd.jpg
548,414571,[],Bharatamlo Bala Chandrudu,"Balachandra, a branded terrorist, seeks revenge for the brutal murder of his father. However, he has to join forces with police officer Ranjit Kumar to punish a group of smugglers.",/fGW5VqjTeD7AcjjgnXiSRc12s45.jpg
549,117421,"[10749, 10751, 18]",Jhummandi Naadam,"Balu loves music very much. He wants to become a famous musician. He left his village and came to Hyderabad to fulfill his dream. He rented a house across the house of Venkata Chalapathi's (Mohan Babu) house. Venkata doesn't approve the way of living of the new generation. So when his friend's daughter Sravya and Balu fell for each other, he became complete against of their love. Now the lovers have to overcome the obstacles of Venkata for the sake of their love.",/wIsIi2SDmYlFRQpw6cvSio5Khcj.jpg
550,149262,"[10749, 18]",Yeto Vellipoyindhi Manasu,"The romantic lives of two people – Varun (Nani) and Nithya (Samantha), are chronicled in this film from their school days until their adult lives. They fall in love multiple times and keep breaking up over minor issues. But deep down, they are so madly in love with each other that they keep giving themselves another chance.",/op3VURd17dgyV1rgMc7R1wceRSE.jpg
551,319832,"[28, 10749]",Guna 369,"Guna is a happy-go-lucky guy who believes the solution to solving issues is not through violence but through compromise.When he is framed for a crime he didn't commit by someone close to him, Guna is left with no choice and forced to the extremes to prove his innocence.",/wp3PlWSfTzHSMgi9OSEUEirjgEp.jpg
552,279119,[35],Mechanic Alludu,"Mechanic Alludu is a comedy based movie in which for the First film to have Akkineni Nageshwara Rao and Chiranjeevi together. The story opens with Ravi (Chitranjeevi) showingup on multiple TV screens as an announcer.After a clash, he is fired from work, and he joins Nageshwara Rao",
553,1088935,"[10749, 35, 10751]",Sridevi Shoban Babu,"Sridevi, daughter of Sekhar, i is a budding costume designer whose creative urges take her to Araku, where she meets Shoban Babu either by design or by accident and falls for him. But there is a catch. Sridevi's father and Shoban's mother are estranged siblings.",/gsTWux7kY9pNzmSYQKzbOPNZX4n.jpg
554,66491,[18],Rama Rama Krishna Krishna,"Rama Rama Krishna Krishna (Telugu: రామ రామ కృష్ణ కృష్ణ) is a 2010 Telugu language film that stars Ram, Priya Anand and Bindu Madhavi in the lead role, whilst prominent actors Arjun Sarja, Nassar, Brahmanandam and Gracy Singh play pivotal roles. This film, directed by Srivas (Lakshyam fame) and produced by noted producer, Dil Raju, released on May 12, 2010. The film got dubbed into Tamil later as Gandhipuram and released on December 24, 2010.",/jKmHQYCYSVT4DJlrfLgGbqfs8Gh.jpg
555,117029,"[18, 10749, 28]",Bujjigaadu: Made in Chennai,"Bujji runs away from his home in his childhood because of a dispute with his girlfriend Chitti. He ends up in Chennai for 12 years, and the rest of the story is about how they meet now to make their love successful.",/fVDPpKS4ylQf1qtEvfaDjh6ehhP.jpg
556,279496,"[18, 28, 10749]",Coolie No. 1,"Coolie No.1 is action romance based movie in which, Ranjani (Tabu), is a rich, spoilt and arrogant girl who has a I dont Care attitude towards life. Ranjanis father is a rich Industrialist Koteswara Rao (Rao Gopal Rao) who resides in Singapore. In an incident Ranjani clashes with Raju (Venkatesh) who is a coolie. Raju vows to do something about Rajinis arrogance and ego. Ranjani goes to Singapore to see her father where she meets up with Bharat (who is none other than Raju who pretends to be Bharat) a modish and rich man in Singapore.",/1f5ZGf7mqQXavMnK01Yy64xzgOf.jpg
557,369949,"[18, 10749]",Kumari 21F,"A young man's love for his girlfriend, who is a model and moves very free to every one is tested by the rumors surrounding her.",/fRDKBHTANhw2UsN15teWPijL56u.jpg
558,292140,"[80, 18, 53]",Anukshanam,"Based on real-life events, this crime thriller traces the terrible trail left by a serial rapist and killer, highlighting the ensuing media coverage, public panic and one police officer's personal crusade to capture the psychopath.",/hqmQddsROslZHobPG9vIp51pf4j.jpg
559,400247,"[10749, 53]",Gentleman,"Two girls, Catherine and Aishwarya, meet on a flight and become friends. They share stories about their respective boyfriends, and Catherine is shocked to find that the man she is dating is a lookalike of Aishwarya's boyfriend. Even more shocking is the fact that when she reaches home, she finds out that her boyfriend has died in a car crash. Catherine decides to investigate the lookalike boyfriend and uncovers a thrilling mystery.",/hoO5BunFOXp5s8WkuRB4SgsruaS.jpg
560,80948,"[28, 35]",Krishna,"Krishna falls in love with Sandhya whose brother is a builder. Jatka, a ruffian loves Sandhya and wishes to marry her. Krishna has to take on Jatka to win his love.",/ye5GOXKxFuGTTjDb1GZiPeNwkBK.jpg
561,422592,"[28, 80, 53]",Ism,An undercover journalist finds himself hunted by corrupt politicians and the gangster whose daughter he betrayed in order to obtain evidence against him.,/68xeIJRZYUINTWNj1BrMSgGwAtt.jpg
562,52944,"[35, 18, 28]",Don Seenu,"This story is all about a ambitious boy named Seenu (Ravi Teja) who dreams of becoming a don. He always likes to be called as ‘Don’ Seenu since childhood due to the strong influence of the Amitabh Bachchan starrer ‘Don’. He grows up with just one passion - that of becoming the World's No: 1 Don. Thanks to his enterprising nature, he gains access to the cream of the city's dons, and uses his cleverness to play off the top two - Machiraju (Sayaji Shinde) and Narsing (Sri Hari), fierce rivals - against each other.",/x87ewrJ2C8fUUqxjNsjU6hHbWJN.jpg
563,859946,"[35, 10749]",Paagal,"After his mother's death, Prem, a young man, searches for love in every woman he comes across. However, when he finds true love in Theera, they face several challenges in their quest to unite.",/oTywVi72cAQxfVWDUfEupOOhxXj.jpg
564,78840,"[28, 18]",Pedarayudu,"Pedarayudu, the eldest brother, sits on an ancestral throne that is cursed and whoever delivers a wrong verdict dies. However, things take a turn after his youngest brother is accused of murder.",/n0o8SkHQh8BuDEgXUhRlEYTrV7q.jpg
565,81087,"[28, 10749]",Maska,"Krish is a happy-go-lucky guy who lives with his brother and sister-in-law. He woos a girl named Manju. Manju happens to be the daughter of a Mla Simhachalam. Krish's only intention is to become rich by marrying her and doesn't have any feelings whatsoever toward her. He also meets a girl called Meenakshi, aka Meenu ; he starts to like her for real and falls in love with her. Meanwhile, Simhachalam and Shinde run against each other in a presidential election in Delhi. Shinde is a man of misdeeds. Shinde tries to find faults in Simhachalam's personal life so that he can expose him in front of the high command of the party, so that his route will be clear to get the party ticket. Shinde comes to learn that Simhachalam has another wife (Sita) and a daughter who live in Hyderabad. He sends his men to find them. .",/9xDHJwQSYLIe7fsa8m23Nd4Tvx2.jpg
566,77715,"[28, 18, 10749]",Badrinath,"Trained by a religious martial arts guru, Badri becomes the protector of Badrinath temple and tries to revive Alakananda's faith in God, unaware of the fact that she has fallen for him.",/bKDb4ZLdBmXjbaSQvO0xtw4ntKR.jpg
567,23972,[53],Aa Okkadu,Dr. Pavitra (Madhurima) is a psychiatrist who works in a mental hospital. Sri Krishna (Suresh Gopi) is a successful criminal lawyer. Bujji (Ajay) works under Sri Krishna. Sri Krishna and Pavitra are disciples of a godman. Pavitra has a family dispute with her brother-in-law and he dies under suspicious circumstances. Slowly a few people associated with Pavitra are killed and the needle of suspicion turns towards Pavitra. The rest of the film is all about who did it.,/k747pXzXnv8zK3jwaVjtCoin8cJ.jpg
568,171384,"[35, 18, 10751]",Dhenikaina Ready,"Veera Narasimha Naidu (Prabhu) is a faction leader in Kurnool who raised his sister Saraswati (Seetha) with love and Affection to make her forget the loss of their Mother. During the marriage time, she eloped with Basha (Suman), whom she loved which led the death of Narasimha Naidu's Father. Thus enraged Narasimha Naidu cuts the leg of Basha which created a rift between the two families. On a case to win the property belonging to Saraswati, Basha wins the case on Narasimha Naidu after a long gap of 25 years. Seeing the sorrow of Saraswati, her son Sulaiman (Vishnu Manchu) vows to unite the two families and waits for a situation.",/bdrcCzcNUzRiNEE7uRXTzzCoG5s.jpg
569,137466,[],Nuvvu Vastavani,"The movie starts with Chinni (Nagarjuna) revealing, on a train journey from Pune to Hyderabad, that he just got out of jail after seven years. His past is revealed in a flash back.  He had been a singer, waiting for the big break. Indu (Simran Bagga) hears his voice, though she doesn't see him and becomes his fan. When Chinni realizes this, he tries to reveal who he is but circumstances place him and Indu in situations where she ends up thinking that he is a rowdy. Chinni ultimately becomes responsible for her losing her eyesight too.  He devotes himself to her from then onwards attending to her every need. She learns to respect and love him too, thinking that he is the singer and not knowing that he is the same person she thought was a rowdy.",/mBehLfOvntzmWMLGYoVEoBRW25Y.jpg
570,154337,"[10749, 18]",Andala Rakshasi,"Gautham, a wealthy man, falls for a woman named Mithuna only to learn that she loves another man. However, a sudden chain of events changes their lives forever.",/xTJSZ1XtPrZrjbHcASNf9GWMXBw.jpg
571,610505,[18],Mallesham,"A sixth-standard school drop-out faces many ups and downs in life when he decides to design a weaving machine to ease the plight of his mother and many like her in his village, who take up Asu work.",/rRU5FoQ03WKLVhrXjxbvqKrhVqk.jpg
572,536429,"[35, 18]",Shailaja Reddy Alludu,Chaitanya and Anu are neighbours who fall for each other. However their path towards marriage is far from easy. A haughty would-be mother-in-law complicates the proceedings. The couple put up a united front to clear their roadblocks.,/2Y4nCSnyPkR1KGpBphomSFj696m.jpg
573,471331,"[28, 35, 27]",Paisa Vasool,A self-proclaimed criminal Theda Singh who’s just been released from Tihar Jail is recruited by India’s premier intelligence agency RAW (Research and Analysis Wing) to infiltrate the gang of mafia don Bob Marley  and ultimately eliminate him.,/kmqbfZnMvW1h9dCrYDSUkmBLODQ.jpg
574,377668,"[10751, 35, 10749]",Subramanyam For Sale,Subramanyam and Sita have a chance meeting in the USA. Their act of a husband and wife to win a 'best couple' contest lands them in trouble as they have to continue the act. But the feelings of their families are at stake.,/rYlpx9JjQw5TX0onVU31Seur9KX.jpg
575,869450,[],Tempt Raja,"Tempt Raja is a Telugu movie starring Veernala Rama Krishna Rao, Divya Rao and Aasma in prominent roles. It is a comedy drama movie directed by Veernala Rama Krishna Rao with T. Shankar as a musician, forming part of the crew.",/ApbpMA0NT6RCIAmtevUZev8sYhe.jpg
576,456983,"[28, 10749]",Courier Boy Kalyan,A courier boy's life turn into unexpected consequences because of a courier received from a social service activist.,/2bRe7mrrvwVBARsXnEHvoPkGV92.jpg
577,81064,"[10751, 18]",Kalisundam Raa,"Raghaviah and Ram Mohan Rao are brothers-in-law. But Ram Mohan Rao is at loggerhead with Raghavaiah because of a family feud. Raghavaiah is nearing his 60's and it's time for his Shastipoorti ceremony. It's time for gathering, folks!",/qbjZ9DWzvoI4bqloZ4jhcHbtbL0.jpg
578,657170,"[28, 18, 10749]",Ruler,"A business tycoon decides to adopt a stranger after he saves her life when someone tries to kill her. It turns out, the stranger has a murky past and while she tries everything she can to save him from it, fate brings him at crossroads with his past life.",/m47ixzeRppFVsTqSKirDt8bzdjR.jpg
579,633146,"[28, 18, 10749]",Entha Manchivaadavuraa,"Abandoned after his parents' death, a short film actor assumes multiple identities to bond with people in need of love and affection.",/j33YnqmLItsqo4wUw0B6qMFmnwy.jpg
580,519616,[18],Lakshmi Bomb,"Lakshmi(Manchu Lakshmi) is a session court judge who announces a severe punishment to a local goon(Prabhakar) on charges of human trafficking. Upset with this, the dreaded gangster attacks Lakshmi with his entire gang and kills her.",/c2b9cYMf99P2WbX4Dr8iV4HrlYO.jpg
581,67677,[],Golkonda High School,"Set on the backdrop of cricket, the story begins with the Golconda High School which housed the best cricket team about fifteen years ago.",/eRrjxoAD6IGrcmxt74wVZ4dfTTa.jpg
582,687355,"[18, 9648, 53]",Valayam,"When his wife goes missing, Arvind must solve the mystery of her disappearance before time runs out and he becomes the prime suspect.",/uNRSlnY8MN3JdvegLTPwxBNUIVm.jpg
583,379697,"[53, 27]",Raju Gari Gadhi,More than thirty people were killed in a haunted house in Nandigama. A TV channel plans a reality show by sending seven participants to spend seven days in that haunted palace. They were lured by an attractive prize money of 3 crore. But they will soon come to know that they are surrounded by ghosts and evil spirits in that palace. Will they survive or is there any uncovered secret about the place?,/57LSrtcuUTqDjo0kQLXfQ1pnJvP.jpg
584,94898,"[18, 35]",Namo Venkatesa,Venkata Ramana (Venkatesh) is a ventriloquist. He goes along with the troop of artists to perform for a local Telugu association in Europe. Paris Prasad (Brahmanandam) is a tour organizer in Europe. He enjoys making people around bakras. Pooja (Trisha) is the niece of Prasad. Venkata Ramana falls in love with her. Prasad realises that only way to make Ramana bakra is to tell him that Pooja loves him too. Pooja is the daughter of a rich factionist in Rayalaseema and she is forced to return back in the middle. Her marriage is fixed with a guy she doesn’t like. The rest of the story is all about how Prasad conspires with Ramana to rescue Pooja.,/qd8LqDVKHHstALmOtrwJgYyynBK.jpg
585,1032287,"[35, 12, 28]",Like Share & Subscribe,Two travel bloggers end up in Araku to shoot some exciting footage – but what happens when they find themselves in the midst of rising tensions between the naxals and the police?,/tD2lbmaf0ZLTYps9dK1HaXsHrHG.jpg
586,367553,"[10749, 35]",Bhale Bhale Magadivoy,Forgetful Lucky falls in love with the demure Nandana. But she doesn’t know he has trouble remembering things and her dad does!,/fa2Nv68gcmgZJbKCJV5T45fwA8P.jpg
587,440454,"[28, 35]",Luckunnodu,"The ironically-named Lucky gets embroiled in a heist when a friend hands him a bag of cash, which was stolen from a don, who stole it from the bank, and will not rest until he recovers it.",/aKgfpz5ijRIkYDnTR3ZOzjHYrUc.jpg
588,66517,[18],Sri Anjaneyam,"Brahmam, a corrupt politician, kills Anji's parents and plans to demolish a temple. To help Anji fight the politician, Lord Anjaneya takes human form to stop it.",/jA05CvkyhsJXeQ8bkuGSTkyNmgu.jpg
589,881478,"[53, 80, 10749]",Konda Polam,"Jobless since four years despite being well-educated, a young man heads to Nallamala forest with his father to help him with konda polam. Will he come out a changed man?",/hn4OCbK52AscMsm5gLsucxf0Lmg.jpg
590,73112,"[35, 12]",Venky,"Venky is headed to Hyderabad to join the police force. However, he ends up embroiled in a double murder on the train. When he joins the academy, he realises that their boss is the murderer.",/xCtw4lF84m57WIh1nIOnZvKMvKw.jpg
591,891445,"[28, 14, 18]",Bimbisara,"Bimbisara is a ruthless emperor of Trigarala in 500 BC. In unexpected circumstances, Bimbisara travels in time and reaches the current day not knowing that a power-thirsty doctor Subramanya Sastry and Kethu are already waiting for him to come. Bimbisara has to deal with modern day hustle and bustle.",/6QxZRJsODH2kNZ6oNd3qug73FoQ.jpg
592,80856,"[28, 18]",Arjun,A young man risks his life to guarantee his twin sister's happiness and protect her from murderous in-laws.,/oe9yrtJtMeqXDFVSH7ESWA9U7YT.jpg
593,300214,"[9648, 53]",Karthikeya,Nikhil Siddharth and Swathi Reddy are back once again onscreen with Karthikeya. The mystery of the Subramanian Swamy temple which has remained closed for years is the crux of the movie. Local people in the village are curious why the temple has been locked up for years? The lead protagonists take the initiative to solve the mystery.,/82hrqmYLaNoz3rHwRDyZwPvJtdx.jpg
594,54069,[28],Ragada,A local village rowdy arrives in the city to earn money by any means and participates in a brawl between two rivals that brings him to their attention.,/q85Sa4CWTJVU0R3q8Dd31Sj2BNz.jpg
595,77035,[18],Lakshmi,Lakshmi Narayana (Venkatesh) is an elder son in a family with 3 brothers and 2 sisters. Lakshmi owns a factory that is worth hundreds of crores. Janardhan (Sayaji Shinde) - a former employee of Lakshmi Industries - plans to take revenge on Lakshmi by creating difference in his family and succeeds in it. The rest of the story is all about why Janardhan separated Lakshmi's family and how he wins back his lady love Nandini (Nayantara).,/hYSTCXxMnqXS0wbMl3ao3WOAsq0.jpg
596,502703,"[10751, 28, 53]",Gayatri,"Dasari Sivaji is a stage artiste on the lookout for his long-lost daughter Gayatri . What happened that broke his family apart? Will he ever reunite with his daughter, is what 'Gayatri' is all about.",/jJonfDUWhvyJE1qTylNUUvrpJXF.jpg
597,811553,"[18, 35, 10749]",Thellavarithe Guruvaram,"A couple that’s about to the tie the knot hardly knows anything about each other. When they decide to run away from the wedding and are forced to spend the night together, will they realise they are in fact made for each other?",/bSLxyPoHPjWUiW7aKhVDhPwzoqS.jpg
598,933476,"[53, 80, 35]",Bhamakalapam,"Anupama, a YouTuber who has over a million subscribers, uploads a new recipe each week. An ancient egg whose value is around Rs 200 crore goes missing from a museum and a murder too happens, and then things take a dark turn. Anupama is also nosy about the happenings in her apartment, she finds herself getting pulled into a tricky situation.",/wuWjJYDqh3MCnXcuj9VkMHvsIVA.jpg
599,478747,"[35, 10751, 10749]",Mahanubhavudu,"Anand is a cleanliness freak, someone suffering from OCD . What happens when a man like that falls in love? Will the person he loves learn to live with his quirks or will he have to change?",/tzTdZ82hqcP4GrJICd1xp1HNMj2.jpg
600,307854,[],Anjani Putrudu,"As a gift from Rama to Hanuman, two blessed children are born to save humanity. An evil sadhu wants to sacrifice them to gain power, and sends out his minion to look for their special birthmarks. At the same time, two corrupted relatives moves into their household. At this dangerous time, Hanuman appears in the guise of a child to protect them.",
601,410275,"[28, 53]",Om 3D,A man who loves his father dearly and protects him from all dangers is shocked to realize certain things that don't seem to be what they are.,/mWtntWMfw1zj4n2xT7HbnpYQNh8.jpg
602,137472,"[28, 10749]",Ontari,"Ontari (Telugu: ఒంటరి, English translation: Alone) is a 2008 Telugu film which stars Gopichand and Bhavana. Choreographer-turned-director Ramana directed this film. the movie was made under reputed banner Eetharam films. The film has been dubbed into Tamil as Subramaniam and in Hindi as Ek Aur Khal Nayak.  Vamsi (Gopichand) lives with his family. Vamsi’s father is Muddu Krishna Rao (Paruchuri Venkateshwara Rao), an affluent sari mandir owner. Vamsi’s friends are Sunil & Rajiv, an MLA. Vamsi falls in love with Bujji (Bhavana) at first sight but she doesn't see him. One day, Bujji meets Mr. Rao & his family, except for Vamsi, who then overhears his family talking to her, discovers that Buji is an orphan and stays in a hostel. Vamsi goes to the hostel and pretends to be a CBI Officer because he wants to talk to Bujji.",/wL1uVEhm76UQwvg3m68A5fzB4yu.jpg
603,280351,[18],Bobbili Simham,"Bobbili Simham is a 1994 Telugu film directed by Kodandarami Reddy. The film stars Balakrishna, Meena, Roja Selvamani and Sharada in lead roles.",/qeRsMwRcF0phDJFNdAvwELVEUdt.jpg
604,370986,"[28, 14, 10749]",Akhil,A cruel business official attacks a tribal village for a stone which the people treat it as something special a guy who thinks he is somehow related to the stone comes to their aid.,/eOllEN8ryvSLMfLVw6mWSLnrTxX.jpg
605,339925,[27],Avunu 2,The lustful spirit of Captain Raju stalks Mohini till the end in this continuation of the first part. A true part 2 in the sense that the second part picks up from exactly the same shot from where the first part ended.,/jGSlLcUJ0dEk7oSbgBAvALrmv4k.jpg
606,519381,[],Naa Ille Naa Swargam,,/zlUHW25Z7ChvJ3auH3LNO9BxuJD.jpg
607,1061919,"[53, 35]",Jagamemaya,"A conman tricks a grieving widow into marriage to make instant cash. However, his life turns upside down when he unearths his wife's secret.",/tw6QnhvKFR0MYnINe7FlZWRBY9A.jpg
608,306962,"[35, 14, 10749]",Yamagola,"Satyam (N.T. Rama Rao) is a youth leader and Panchayati Board President. He interferes with the ex-President of the board, Rudrayya (Rao Gopala Rao) from executing his corrupt practices. Satyam and Rudrayya's daughter, Savithri (Jayapradha) are in love and plan to get married. So Rudrayya gets Satyam killed with the help of a professional killer (Prabhakar Reddy). Satyam immediately goes to heaven. He angers the King of Heaven, Indra (Kanta Rao) while he enjoys the dance by Rambha, Urvasi and Menaka. He sends him straight to hell headed by Yama (Satyanarayana) and ably assisted by Chitragupta (Allu Ramalingaiah). In hell, he influences the soldiers of death, Yama's army using communist theories and rights of labor, and turns them against their leader-Yama, and Hell shuts down. Yama sends him back to Earth. Yama and Chitragupta visits Earth on a holiday trip and experiences the funny aspects of Humans. Satyam changes his name and teaches Rudrayya a lesson.",
609,40906,[35],April 1st Vidudala,"Young Divakaram, a habitual liar, takes up the challenge of transforming himself into an honest man in order to win the heart of his lover, Bhuvaneshwari.",/q1mcicdlCtx8uj2qIjVPiL0YVwf.jpg
610,795141,"[10749, 53]",Ichata Vahanamulu Nilupa Radu,"A young man working in an architecture firm falls for his intern. As romance blossoms, in a bid to surprise her, he accidentally enters a crime scene. How he gets out of being framed for it forms the tale.",/eqVls8K8eEjkKAQ2HPr4tbD0VgB.jpg
611,461092,"[28, 14, 10749]",Angel,"During the course of an excavation work for the construction of a new capital at Amaravati in Andhra Pradesh, workers chance upon an antique idol of a young woman. A smuggler strikes a fancy deal to smuggle the statue abroad, but first it has to be transported to Hyderabad by road. And the antique idol suddenly comes to life!",/tY2u7TB8DOqPEw1aFdDTTfxOZHy.jpg
612,307811,[],Chettu Kinda Pleader,"Film starring Rajendraprasad, Kinnera and Urvashi",/ekTpsGGnm9K43jmklhWbBsB1gWL.jpg
613,76116,"[28, 18, 35, 10749]",Alluda Majaka,"Sitaram, the son of a rich man, is robbed of his wealth by his enemies. Later, he is wrongly arrested for murder but manages to get out of jail and avenges the injustice done to him and his family.",/1IgxixBARsjlYuPhRyAJi4D8Inf.jpg
614,307920,[10749],Ninne Premistha,A young man meets with an accident and loses his eyesight; three months later he recovers and goes back to his job. He meets a lady who is very affectionate towards him; But why?,/9gcFyBHbguANsEfmXxueSpX6EVb.jpg
615,82168,"[28, 18]",Naa Alludu,"Karthik seeks revenge after Bhanumati refuses to hire him despite his qualifications. When he vows to marry one of her two daughters, Bhanumati hires a bodyguard for them.",
616,115048,"[10751, 10749]",Aavida Maa Aavide,"Aavida Maa Aavide is a 1998 Telugu film directed by E.V.V. Satyanarayana. The film stars Nagarjuna Akkineni, Tabu, and Heera Rajagopal in important roles.",/y1amdQqBdhyjzGX5RV8ZiBlUMLd.jpg
