,id,genre_ids,title,overview,poster_path
0,579974,"[28, 18]",RRR,A fictional history of two legendary revolutionaries' journey away from home before they began fighting for their country in the 1920s.,/nEufeZlyAOLqO2brrs0yeF1lgXO.jpg
1,256040,"[28, 12, 18, 14]",Bāhubali: The Beginning,"The young Shivudu is left as a foundling in a small village by his mother. By the time he’s grown up, it has become apparent that he possesses exceptional gifts. He meets the beautiful warrior princess Avanthika and learns that her queen has been held captive for the last 25 years. Shividu sets off to rescue her, discovering his own origins in the process.",/9BAjt8nSSms62uOVYn1t3C3dVto.jpg
2,690957,"[28, 18, 53]",Pushpa: The Rise - Part 1,"Pushpa Raj is a coolie who rises in the world of red sandalwood smuggling. Along the way, he doesn’t shy from making an enemy or two.",/r1yAzVQNbCbPTbB3GZFour9Qr0t.jpg
3,350312,"[28, 12, 14]",Bāhubali 2: The Conclusion,"When Mahendra, the son of Bāhubali, learns about his heritage, he begins to look for answers. His story is juxtaposed with past events that unfolded in the Mahishmati Kingdom.",/21sC2assImQIYCEDA84Qh9d1RsK.jpg
4,901277,"[80, 53]",CSI Sanatan,"When a buisness tycoon Vikram Chakravarthi gets murdered, CSI Sanatan known for his genius crime-solving abilities is appointed to investigate. Sanatan shortlists five employees as suspects but soon the case takes a turn that shocks the nation.",/yscCuJsNYDh2vHc6VrASnZcbaDw.jpg
5,148265,"[14, 28, 35]",Eega,"Nani is a flower decorator, madly in love with his neighbor Bindhu. He gets killed by the baddie, Sudeep, a powerful businessman. Nani comes back as a housefly to get his revenge.",/gqcPTpQNe2OFMFXB8U7duJ2IHxZ.jpg
6,1034590,"[9648, 53, 27, 14]",Virupaksha,"Set in a village named Rudravanam in 1990's, Surya along with his mother, visit there after a long time. Suddenly a series of mysterious deaths occur due to an unknown person's occult practice and whole village is scared. Will Surya find the person causing the deaths and save the village?",/fqMn4h9ctOyumII2nXDnm5mRTxQ.jpg
7,1096417,"[35, 18]",Sathi Gani Rendu Ekaralu,"Confusion, comedy and violence ensue when a debt ridden thief stumbles upon a suitcase with uncut gems in his farm land.",/nTfvnH68dnKhTJ2vqd0F1wYG8sm.jpg
8,23790,[28],Magadheera,"When Harsha, a bike stunter from Vishakapatnam, accidentally meets Indu, he discovers his warrior life Kala Bhairava in his last birth. The remaining story explains how Indu and Kala Bhairava are connected.",/l1FmwvRwJR7iUP2MAdsY01FUsq5.jpg
9,372399,"[10751, 35, 10749, 18]",A Aa,"The love affair, conspired by creation, between Anasuya Ramalingam and Aanand Vihari.",/pDkmxToe0sNQGNaur5pYWGWFXEX.jpg
10,454292,"[28, 53]",Saaho,"A battle for power ensues as warring gangters thrive to gain possession of a ""black box"" that can make them richer than they already are, and an undercover cop intervenes with the help of his sharp intellect and an instinct to kill.",/rWXIpR2uPkwb1Hrhjj2FA62FGdu.jpg
11,894803,"[10749, 18]",Sita Ramam,"Afreen, a rebellious Pakistani student sets ablaze the car of an Indian in London. Angered Afreen returns to Pakistan to ask for money from her grandfather that she has to pay in a month's time as damages. However, she gets to know that he is no more and the only thing he has left for her is a letter-delivering task, written by Ram to Sita. As Afreen sets out to find Ram, there begins her journey of discovering the secret behind the 20-year-old letter.",/vvxXO0TekcEa7hnXo2qCgB3U3e2.jpg
12,628241,"[28, 35, 18]",Ala Vaikunthapurramuloo,"Fate plays a vital role in connecting the life of Bantu, a son who seeks validation from his cold-hearted father with the life of Raj, whose millionaire father wishes that he was more assertive.",/48DIQOSEgpoWUFBrmHW2En6aNZQ.jpg
13,473234,"[10749, 18, 28]",Arjun Reddy,"When his girlfriend is forced to marry another man, a troubled young surgeon begins to self-destruct.",/kHubDgL59I5hCn7ccBYvU7bKY1r.jpg
14,607313,[28],Sarileru Neekevvaru,A tough army major is deployed to Kurnool on a mission to keep the country safe from external threats.,/2IhWzaIOowmXattw8Xozwr9rJ76.jpg
15,540468,[10749],Geetha Govindam,"Vijay Govind, a young college lecturer who dreams of marriage falls for Geetha, a level-headed woman who's wary of strangers and isn't easy to convince. While things seem to go smoothly, Vijay makes a terrible mistake which not only derails any hope for his love story, but also potential repercussions with his family.",/sTreb0ajewXqeIqAyZ0IWtafoB5.jpg
16,215248,"[28, 53]",Yevadu,"Satya is given a different face after he suffers burn-related injuries. After being released from the hospital, he deals with the murderer of his lover Deepti. But his new face has given him new foes.",/euSAn9sVeS4Qnaj1ZWDw56gPi9W.jpg
17,679919,"[28, 18]",Acharya,"Acharya, a middle-aged Naxalite-turned-social reformer, launches a fight against the Endowments Department over misappropriation and embezzlement of temple funds and donations.",/hVgTZdg25d8RN2hIHbqSTijdeX1.jpg
18,443635,"[28, 35, 80]",DJ: Duvvada Jagannadham,"A righteous young man who helps everyone gain their rightful justice, gets recruited as an undercover agent to work on a high profile case that involves a crime lord working for a corrupt minister who also happens to be the father of his romantic interest.",/rLJ3xyM5iFCfXNSbDOkGZ5ms6oX.jpg
19,496495,"[18, 36, 10752]",Sye Raa Narasimha Reddy,"Gwalior Fort, during the Indian Rebellion of 1857. In a moment of despair, Lakshmibai, Rani of Jhansi, encourages her men by telling them the heroic story of Uyyalawada Narasimha Reddy, a brave Telugu chieftain who took up arms in 1846 to protest against the numerous arbitrariness and crimes perpetrated by the leaders and military forces of the East India Company.",/uEheujJysophwGaqHWPu1UCPthl.jpg
20,1114702,"[18, 10751]",Vimanam,,/d1FQfGMDGRiPqqG5MTC7DZi4joY.jpg
21,501987,"[18, 28]",Bharat Ane Nenu,"Bharat, a graduate raised in London clueless about the future becomes the Chief Minister of Andhra Pradesh due to the circumstances. New to India and with no political knowledge he learns the ropes quickly and governs efficiently. However, while he endears himself to the crowd, he makes enemies out of the political class, including his own party members who create trouble for him and try to stop him from bringing in changes in the society.",/a0hFV8G0ofyPgPEjVcYrueuxFex.jpg
22,541487,"[18, 28]",Maharshi,"Rishi Kumar is a billionaire and the CEO of Origins, someone who has always strived for the success he now owns. His friend Ravi needs help, how will he come through?",/pV6xLQh54ga8oaQqJtUqLp12LwQ.jpg
23,500494,[28],Naa Peru Surya - Naa Illu India,"Despite having serious anger management issues, Surya, an Indian Army officer is a brilliant officer but when anger takes control of him he is impossible to subdue. In spite of this issue, he achieves his goal of serving the country by overcoming the hurdles.",/46zecZYX8rWeDlr5PosCd1bC1Up.jpg
24,566402,"[28, 18]",Vinaya Vidheya Rama,"Ram is one among the five orphaned boys in Visakhapatnam, adopted by a doctor who ensures them a roof to live under, with dignity. Ram goes to any extent to protect his family and he's a handful for the baddie to handle in a time of crisis. How does Ram protect his family when they need him the most?",/tOjSnrKwI3qVKMHn5ofwc2K3Sm3.jpg
25,868666,"[28, 18, 53]",The Ghost,"An ex-Interpol officer wreaks havoc and sends shock waves across the global underworld but goes missing in action, only to remerge years later, for his beloved family.",/AulIkX8l9u17lcQfEubU8n0cnwk.jpg
26,1130781,"[27, 53]",Boo,"Four friends gather to celebrate Halloween, and they begin reading an intriguing horror novel. Things take a strange turn as they begin to experience bizarre events while reading the book. Will they be able to escape the spirit that haunts them?",/8VszbVarbnPamsVwQAZDUCpIcfG.jpg
27,1093983,"[35, 18]",#MenToo,"Aditya, Sanju, and Munna are friends and regulars to a unique pub named ‘Stags Only’. One day, at the pub, they befriend an IT employee Rahul who lost his job due to sexual harassment allegations. Rahul's destiny triggers a change in the lives of the three friends.",/f3hy4P0yMm7zYXYmaOeueA6BflB.jpg
28,885184,"[28, 53]",Dasara,"In 1990s, Set in small village Veerlapally, Dharani, Vennela, and Suri are childhood friends. Dharani loves Vennela, but she has Suri in her mind. Knowing Suri’s interest in Vennela, Dharani sacrifices his love and helps get them married. But Local politics between Rajanna, Shivanna and the latter's son Chinna Nambi threaten to disrupt their lives.",/xgIbeYWlfzSGHJ8VtawQ4rf52a7.jpg
29,87614,"[18, 28]",Sye,"The story is set in the backdrop of a college that is riven by two groups led by Prithvi and Shashank. Though there is nothing malicious between the groups, they just can't see eye to eye on anything. The only thing common between the two are their abiding passion for rugby. Whenever a problem crops between the two, it is usually settled with a bitter scrum on the rugby field. As it happens, the college land falls into the hands of a local dadha Bikshu Yadav. This is good enough reason for the two groups to forge a common identity and fight for the land. Prithvi and Shashank bury the hatchet and get back the land. This is too much of a bitter pill for the dadha to swallow. And so he dares the students for a rugby match with his own group.",/pp0Eljay7pOt9xaN0FEfE97B3zZ.jpg
30,333876,"[18, 28]",Son of Satyamurthy,"The son of a rich businessman struggles to save his father's wealth after his demise. However, he faces many challenges when he becomes the sole breadwinner of his family.",/oQq3FMD952F8Rnu619O2boTK1Do.jpg
31,605153,"[28, 36, 18]",Major,"This biopic follows the life of Indian Army officer Major Sandeep Unnikrishnan, from his childhood to his heroic actions during the 2008 Mumbai attacks.",/sJOfJuyQVZPwNQ8g21Qv0lojQhC.jpg
32,1129654,[35],Pareshan,"Upcoming comedy movie directed by Rupak Ronaldson, Pandith Vijay Kumar, Aryan Sandy.",/bBZrhlzFOjEQl7vzNosRu1ab2Ke.jpg
33,913046,"[36, 14, 10749]",Shaakuntalam,"Shakuntala, daughter of Meneka and Rishi Vishwamitra lives in forest with her teacher, Rishi Kanva. In the forest she meets King Dushyant, falls in love with him and the two get married. After she has their baby (Prince Bharata), Dushyant leaves her in the forest with a promise to come back for her soon. However, due to a sage's curse, Dushyant forgets all about Shakuntala, until destiny brings them together again.",/6YKaTWjZckGH5lb3cRFHWWIjVk2.jpg
34,1130143,"[35, 10749]",Mem Famous,"After a shattering event that leaves three reckless lazing youngster friends with no hope and mounting debts, the trio must finally pull up their socks and do something worthwhile despite their incompetence.",/nyD8twFBUkkPuqzJBt8EHOh5VNr.jpg
35,673392,"[18, 10749]",Radhe Shyam,"Vikramaditya, a world-renowned palmist, believes love does not exist in his stars, until he meets Prerana. But when destiny tries to pull them apart, will love prevail?",/8Lj4hi6PhXjSq5yBvNluPH0rlbZ.jpg
36,117058,"[28, 10749]",Desamuduru,"After Bala, who works for a TV channel, gets into trouble with a goon, he is sent away for an out-of-town assignment. There he meets and falls in love with a girl who gets kidnapped by a gangster.",/l9eVUQdGAEf9KPQxUddc7iE7UFS.jpg
37,530581,[10749],365 Days,This film tracks a hasty marriage through its first 365 days.,/AoFyZGDgfrQuH8ptYb41KVnTjJp.jpg
38,534530,"[28, 18]",Aravinda Sametha Veera Raghava,A young scion of a powerful family with a long history of violence decides to put an end to the bloodshed which leads him to a path of self discovery.,/wKuOZdP0i6hlv5veDAUSBZ2mUaK.jpg
39,374954,"[28, 18]",Sarrainodu,"Only one man can stop a villain who, backed by his father, brutally murders anyone who gets in the way of his unscrupulous real estate deals.",/9r4LCgznHZWg2vdxbZRqnlFpKIC.jpg
40,82255,"[18, 35, 10749, 10751]",Nuvvu Naaku Nachav,"Venky and Nandini's relationship changes from mere friendship to something that is more romantic. However, love only blossoms between the two after Nandini's marriage is fixed elsewhere.",/8SU8u4Aez5O5aAABOoKVn1xnqvl.jpg
41,262227,"[35, 28]",Race Gurram,"Ram and Lakshman, aka Lucky, are brothers who are polar opposites in nature. Their mother wishes to see them united.",/rNIsCxgrtOGRDDa4P06tfgKbxua.jpg
42,365187,[28],Nannaku Prematho...,"Subramanyam, a businessman, is on his deathbed when he tells his sons about a cunning man who stole most of his wealth. Hearing this, Abhiram, the youngest son, lays out a plan to seek his revenge.",/t8RGpSw86jKFpxxnjywVBNiuPx7.jpg
43,459713,[18],Mahanati,"Mahanati depicts the life and career of one of Telugu cinema's greatest and most iconic starlets, the first Indian female super star, Savitri.",/9VaFZ5Y5S2YHz7eIlBCRKY9wBJc.jpg
44,466147,"[10749, 28, 53]",Jaya Janaki Nayaka,"Gagan is very much in love with Sweety aka Janaki, a sweet-natured girl, ever willing to lend a helping hand to those in need. But she ends up rejecting Gagan and later finds herself in a situation from which there seems no escape. Why did Sweety reject Gagan and what does he do when he finds her in a dangerous predicament.",/eB2aF05kTEcH9Bhu5JY7BNNrgAm.jpg
45,23381,"[28, 53, 80]",Pokiri,"Pandu is a ruthless contract killer and Sruthi falls in love with him after a few meetings but hesitates to confess her love to him as he is a reckless criminal. Though a goon, Pandu also has certain rigid principles that leads to an enmity with Ali Bhai - the biggest mafia don in the town.",/92nwCPbcMzTi8PGB82JU7EFCiaG.jpg
46,37172,"[28, 53]",Athadu,"A professional killer is hired to fake the assassination of a politician. However, when the politician is killed and he is framed for his murder, he takes on a dead man's identity to escape the law.",/dV2h6dx5nUatgNClkqCaKKTmA4O.jpg
47,1032293,"[35, 10751, 10749]",Anni Manchi Sakunamule,,/rUX0hS51w2lIiMBVvfMHpJfKW6W.jpg
48,716255,[10749],Most Eligible Bachelor,"A well-educated, ‘settled’ NRI falls for a stand-up comedian and wants to marry her. But when she knows what she wants from her husband, will he fit the bill?",/t7myQADi9CzpdcVWNWVAsK8o2WF.jpg
49,249772,"[28, 53, 10749]",1: Nenokkadine,"A schizophrenic rock musician, is convinced that his parents were murdered by three men. Taking the support of a journalist, he sets out to find the culprits. Will he succeed in his mission, and in the process, what will he learn about his own roots?",/dYpqpA7BsDHeyAGs9AAEPhZmbck.jpg
50,193197,"[10751, 18]",Seethamma Vakitlo Sirimalle Chettu,Brothers Peddodu and Chinnodu are unemployed and do not get along well due to their contrasting natures. They have problems marrying the women they love before an accident changes their lives.,/uUEDkRwrhIMQUE9eHC1VvfbW5yo.jpg
51,80276,"[28, 18, 35]",Dookudu,A young policeman hunts down the men who caused the accident that put his politician father into a coma.,/e9uffrN9z22uuiBF9B0bTDDvbjz.jpg
52,674779,"[10749, 28, 35]",Bheeshma,"Bheeshma Prasad, a simple meme creator has his life turned around when he wages a war against a powerful agro company that creates harmful chemicals to increase the crop yield and make more money.",/5E5BzNyjl9rIG8xaB5h9I7KsZdS.jpg
53,888234,"[28, 35]",Dhamaka,"Swamy and Anand Chakravarthy are lookalikes. Swamy is a jobless guy, while  Anand is the son of Nanda Gopal Chakravarthy, running a company called People Mart. Under dicey circumstances Pranavi, a pretty young girl falls in love with both of them. When JP, a monstrous corporate honcho seeks to acquire People Mart through unethical means, Anand and Swamy’s lives get intertwined.",/l0E50ILyzg0AyjKuV45aEPuIOz4.jpg
54,794362,"[27, 14, 35]",G-Zombie,Sara is a research student who wants to make an immunity booster to save humanity. Her experiment however turns people into zombies and in comes Dhruva to save the day.,/2suj5y3WMaSC7zg4L9kMnsRiomy.jpg
55,298536,"[10749, 35, 18]",Oka Laila Kosam,"A carefree young man leading an aimless life falls in love with a cultured and simple woman, but she does not reciprocate his emotion. However, when circumstances force her to marry him, he embarks upon a journey to make his wife fall in love with him. Will he succeed in his mission?",/2R7f9UNDO1eeViLfkK5rXcCMh3L.jpg
56,253533,"[35, 18, 14, 10751]",Manam,"A married couple die in an accident, leaving behind a son. As he grows up and becomes successful, he comes across reincarnations of his father and mother as youngsters, and vows to bring them back together.",/lE9abet9ezwSUXZf0UV6dk0NT0e.jpg
57,563604,"[18, 28, 10749]",Dear Comrade,A hot-blooded student union leader falls for a state-level cricketer but his anger management issues and violent streak threatens to derail their love story .,/pzOELvBuafrpflQQDv9babJ9EvM.jpg
58,901220,"[28, 53, 80]",Sivudu,"A rural entertainer laced with action, drama.",/38tlzBl4bSlzq2CpdbxPpU6gCbN.jpg
59,393841,"[10749, 35]",Pelli Choopulu,"Fed up with his carefree attitude, Prasanth's father fixes his marriage to make him responsible. However, meeting an ambitious girl changes his life for the better.",/1v7MyHGhdtWlzWzz0r8S3EEww0L.jpg
60,197999,"[28, 10749]",Iddarammayilatho,"A young woman becomes embroiled in a financial and political conspiracy while studying in Spain, as she meets a young musician with a somewhat dark past unfolded through the pages of his lover's diary.",/bsh8YdNxq66oH0MvJFd7hjlq6Fq.jpg
61,74154,"[18, 35, 10749]",Nuvvostanante Nenoddantana,"Siri and Sriram fall in love with each other and plan to get married. However, his mother disapproves of their relationship.",/zixbDSR1gOHgcATGdMaq20LjZEL.jpg
62,804277,"[53, 28]",Godse,"Vyshali, the assistant superintendent of police, is forcefully tasked to deal with unknown kidnapper Godse, who holds some high-profile personalities as hostages. Why did he kidnap them, what are his demands, and what does he want to achieve?",/4d9eICFsRBFtQdC4MfCQ1Tg8DnJ.jpg
63,892269,"[28, 53, 35]",Ravanasura,"An investigating officer is assigned to investigate few brutal murders, where he zeroes in on Ravindra, a criminal lawyer who has penchant for secretly committing murders as the mastermind behind the crime.",/lI8qMT1QtkHy2yiSpj2FCEMV0Tw.jpg
64,410994,"[28, 80, 53]",Dhruva,"A committed police officer is on a very dangerous mission to destroy the most corrupt person in the country, Siddharth Abhimanyu.",/hh7D1fLjet1Ce1kcCkk5TVr3g9O.jpg
65,405924,"[28, 18]",Janatha Garage,"Anand is an environmental activist who lives in Mumbai. A chance exchange programme takes him to Hyderabad and here, a chance encounter with Satyam results in him taking over the Janatha Garage from the latter.",/sEttn6LS1qXOi00oCVfjRnnHY1b.jpg
66,848829,"[35, 10749]",Crrush,The plot revolves around the life of three youngsters. They dream to shift to America with a special desire.,/clsrqgxP8KU6YBqB59BXmWg9kVm.jpg
67,811945,"[80, 53, 28]",HIT: The 2nd Case,"Krishna Dev aka KD, a laidback cop working in Andhra Pradesh State HIT, takes on a gruesome murder case. As KD unravels the layers of the crime, the stakes rise unbelievably high and the threat comes unusually close.",/iujSvQImdSTKDaIjTmZ2hDzgFti.jpg
68,34763,"[28, 35]",Aarya 2,"Two young boys staying together at an orphanage become friends. One of them is adopted by a wealthy family and grows up to become the owner of a software company. He provides employment for his friend, but when they both fall in love with the same young woman, conflict emerges.",/kjbbx8kV6pNhNXX9aRsVDwyEJbm.jpg
69,683342,"[28, 80, 53]",V,"DCP Aditya, a celebrated cop, faces his most unsettling case yet involving a mysterious serial killer who has been brutally killing his targets and leaving behind notes challenging Aditya to nab him. Teaming with Apoorva, an aspiring crime novelist, and the police force, Aditya finds himself walking on thin ice upon discovering the killer has another challenge for him: to prevent four more murders from happening or give up his medals and resign. What he is yet to find out is the killer's past and his desperation to carry out the killing spree without fail.",/iBVcwOVZNGNCNlOLFmcYJW83tTu.jpg
70,72440,"[12, 14, 28, 10751]",Once Upon a Warrior,"In a teardrop-shaped land called Sangarashtra, a 9-year-old girl with special healing powers tries to save her homeland from the tyranny of an evil queen with the help of a blind swordsman.",/2lA2vPWGJStW9tY2NqybBLcy5hl.jpg
71,1034587,"[28, 53]",Amigos,"Siddharth, a youngman who runs a family business is astonished to find his doppelgängers Manjunath and Michael on getdopple.com. After meeting up in Goa, they come down to Hyderabad to help Siddarth win over Ishika, a girl looking for superman to be her husband. But things take a drastic turn when NIA swings into action to nab Michael, aka Bipin Roy.",/mhPhEvh2ffBdbgiSIjrlkqAGwNH.jpg
72,900222,"[80, 53, 18]",Yashoda,"Looking to save her sister, Yashoda, a desperate woman agrees to be a surrogate and move in to a plush facility - but nothing is as it seems. In the world outside Eva, a Hollywood starlet dies under mysterious circumstances, so do a tycoon and a super model. An unknown drug seem to hold the key to the whole mystery.",/f5OiXMDSARtHK4vdGBr6ZGgrw7B.jpg
73,353533,"[28, 18]",Srimanthudu,"Harsha, a multi-millionaire guy who has everything but there is something else he's looking for and in the process he adopts a complete village trying to bring change in the people.",/sJoSrecqwuZMPMzUGn5jXpNwEq0.jpg
74,63430,"[10749, 18]",Ye Maaya Chesave,An aspiring Hindu director falls in love with a Christian girl whose parents disapprove of their impending relationship.,/wqVSj0Odz8MsNkfaaAgcYiE2fVu.jpg
75,467649,"[18, 10749, 35]",Fidaa,Two young people embark on a winding and rocky path to love after meeting at a wedding.,/cvpwHdJuUzm544lvleBIAxGdzBB.jpg
76,609096,"[18, 10749]",Viraata Parvam,Vennela has fallen for Aranya aka Ravanna’s poetry and the man both. What happens when she sets out on an arduous journey to be with him?,/pebVSzYPI9qR4xlmDt5dQXoVxP3.jpg
77,485789,"[53, 27, 80]",Bhaagamathie,"Accused of murdering her husband, IAS officer Chanchala, is taken to a haunted house called Bhaaghamathie Bungalow, where police and CBI officials interrogate her to dig up dirt on a politician she had worked under. As she's left alone in the haunted house, spirits take control of her and IAS Chanchala transforms into an unrecognisable person. How this impacts her and everyone around her forms the crux of the story.",/quGwnd4DjXOX25aLwuuRJJ5YmlS.jpg
78,681435,"[28, 80, 53]",Red,"When civil engineer Siddharth is arrested for a murder on the basis of a pictorial evidence, cops discover his lookalike Aditya and realize they have only 48 hours to solve the case.",/7cEEDAHhMGtoWfYXJxelVMRwLu0.jpg
79,1104031,"[10751, 18, 35]",Malli Pelli,"Narendra and Parvati often work together and love blooms on sets. But given that they already have partners, will their love prevail?",/rvbQXeFRRVtpNg2OK8J35vrLaRd.jpg
80,83889,"[28, 80]",Businessman,"Just as the cops have declared the end of Mafia in Mumbai, a man named Surya arrives in the city with the intentions of conquering it.",/aID26sABfyUqHhYbeW3o8V3I6tq.jpg
81,989017,"[28, 18]",Waltair Veerayya,"A notorious smuggler Waltair Veerayya is hired by a CI Seethapathi, reaches Malaysia with the ostensible mission of kidnapping a drug mafia leader named Solomon, who escaped India after wreaking havoc on the RAW agents and local policemen. Veerayya manages to pummel Solomon, who is fiercely protected by his ruthless gang-lord brother Kaala. Tables are turned, when Veerayya reveals that he shares a turbulent past with Kaala & an ACP Vikram Sagar who is hell-bent on ending his smuggling activities.",/g4mx225pbBH5i0KSjc3t1pO5hIy.jpg
82,604434,[],Sita,"Sita is a materialistic woman who only cares about materialistic gains and nothing else. MLA Basava Raju lusts for her and wants her to give him what she promised him for helping her. The villain of their tale is Ram, a man who’s way too innocent for his own good. How does Ram help Sita out of the fix she’s in forms the crux of the story.",/9s629MKjTxzCotDaFNy3qOTj0BM.jpg
83,31629,"[27, 14, 53]",Arundhati,Arundhati  belongs to Gadwal samsthanam in 1920’s. She is known for her bravery in saving the Samstanam by killing Pasupathi an evildoer. But the spirit of Pasupathi haunts that place. Another girl is born in the same lineage after 3 generations and she is named as Arundhati. The spirit of Pasupati is after Arundhati to take the revenge.,/xQ0mGlnlAt6wLWZc3rm6LGFPzwl.jpg
84,369925,"[18, 10751, 10749]",Oopiri,"A convict out on parole finds employment as the caretaker of a multi-millionaire, who is paralysed from neck down.",/iXsJEdk1P3V2cm2TSRBuG8ZS1pz.jpg
85,592898,[18],Jersey,"After his career fails to take off, a gifted cricketer in his mid-thirties decides that he’s not ready to give up quite yet.",/bU9q9yVtxeBiC0Do27CekHXNE6D.jpg
86,535172,"[28, 878, 53]",Disco Raja,"Found frozen and brain-dead in Ladakh, Vasu is brought back to life but with no memories of who he was, until he starts to regain his past and piece it together to find the people responsible for his murder.",/2yWmWOPIq7NjkpD5Wv3aaumPptO.jpg
87,1103708,"[27, 9648, 53]",Asvins,A group of Youtubers who accidentally unleash a 1500-year-old evil that crosses over from the realm of darkness to the human world.,/1dleEIjnnCQXMNiwIyBcd9sTieD.jpg
88,113728,"[28, 18]",Dhammu,"Rama Chandra, an orphan, gets involved in a feud between two royal families while trying to woo Sathya, his lady love. He soon realises that the lives of his fellow villagers depend on his choices.",/xO3epYityNOlkeLCdGOXVT2HwDw.jpg
