,id,genre_ids,title,overview,poster_path
1652,1118264,"[10749, 35]",Raa,"Sridhar, a womaniser, meets his match when he tries to seduce Shanthi, who refuses to fall for him. Later, he learns that Shanthi has a hidden motive for resisting his advances.",
1653,1118168,"[10749, 18, 35]",Selfish,,/mHi1BIe4zRee75EbQUnILdIsfls.jpg
1654,1116449,"[27, 53]",Another,A student experiences mysterious events after waking up in a library.,/bvnsupgMACkMvck7lTXllp6dgqO.jpg
1655,1115760,"[53, 28]",Agent Viper,"As facing his own inner demons, a demented secret agent rushes against time to save an unknown from the clutches of a formidable foe.",/h1CkiUnQL91cmCcgh0sFrCod4pA.jpg
1656,1113783,[],Bhakta Prahlada,"Bhakta Prahlada is the first full length Telugu talkie film based on the story of Narasimha and Prahlada in Hindu epics. The film is now lost; surviving artefacts include a few stills, advertisements, and reviews.",/6RHbYSAIKXJlBxkuvPKy5J1dWjX.jpg
1657,1113486,[],Rao Gari Illu,"Anand Rao, a public prosecutor leads a happy life with his wife Jaya and five children. One day, Jaya dies in a road accident. There onwards, Anand Rao becomes a drunkard and his house is completely disintegrated. Anand Rao's friend SP Raghava Rao sends his cousin Shanti as governess to take care of the children, in her acquaintance, they become as a straight arrow and develop a lot of affection towards Shanti.",/dt5y8z8ZvUbYfR2i6jurH3eoda4.jpg
1658,1113482,[],Manasa Veena,"Manasa Veena is a 1984 Indian Telugu-language film, directed by Relangi Narasimha Rao and produced by Rama Arankannal. The film stars Revathi, Rajkumar, Balaji and Sumithra. The film has musical score by M. S. Viswanathan. The movie was dubbed into Malayalam, with the name Thennal Thedunna Poovu.",/dLGJWY7NsMkhIwxxYQ0zoSgY2qt.jpg
1659,1111343,"[28, 18]",Pratighatana,"After a lawyer's wife is humiliated by a gangster in public, and he is unable to save her, she goes on to fight against corruption in politics",/20h7cH5ljPcBwrI0UszzFw3tEO7.jpg
1660,1111335,"[10749, 18]",Andamaina manasulo,"Tushar, a young man, falls in love with his classmate, Sandhya, who harbours feelings for him but ends up marrying someone else. Meanwhile, Tushar's friend, Bindu, finds herself attracted to him.",/mnjCAo44SRI770mSv4HgvHHNQXc.jpg
1661,1108693,[35],Bitcoin,Two friends plan to swindle a stranger,/b4nC9VEdOnJ8QUCNQrsmQyGeWcC.jpg
1662,1108193,"[10751, 35]",Shashtipoorti,,
1663,1107009,[],Nilakanta,,
1664,1103714,"[10749, 18]",Appudappudu,"Sundeep and Radhika get married at their parents' behest. However, things take a turn when they soon realise how wrong they are for each other and plan to get a divorce.",/uaKnJWHKcJUaSZsJc8furEpyk9R.jpg
1665,1102488,"[28, 18]",Rahasya Gudachari,,/e5LudDOJamBL9WhY987G0YROvvO.jpg
1666,1102353,[],VishwakSen 10,,
1667,1100031,"[99, 36]","O Friend, This Waiting!","A wandering poet-musician, Kshetrayya wrote for devadasis, the dancing courtesans at the courts of the 17th century Nayaka rulers. His padams became the most cherished of her songs of love. O Friend, This Waiting! reflects on the entwined fortunes of the padams and the women they were written for, from the 17th to the 20th century, while dwelling in the performance spaces of temples and courts of the Nayaka period.",/4Tr12Pep5bBMwYyWAO3Ay8R8qF7.jpg
1668,1099485,[],Kiran Abbavaram 9,,
1669,1099450,"[35, 10751]",Intinti Ramayanam,"Following a misunderstanding, a newlywed couple, Jayakrishna and Vijaya, breaks off their marriage. Mohan, Jayakrishna's friend, and his wife decide to step in and help them.",
1670,1098457,[],Chitrame Idhi Chitrame...,A Mumblecore Film,/4M8VNarUQB6FOyZ5yGrnPG6pJtS.jpg
1671,1098250,"[28, 35]",Veyi Subhamulu Kalugu Neeku,"To fulfill an oath to his father, Chaithu, a successful TV show director saves each penny to buy his dream house. After buying the house, he faces unexpected problems that keep his girlfriend at bay. What will he do?",/qD1v9KE6RIUrS7ZFzUmeEILpKQe.jpg
1672,1098249,"[10749, 35, 28]",Mr. Kalyan,"Chapel, aka Coach runs a business with a bunch of call boys, but his earnings take a hit when Kalyan, aka CB, enters the market. Parallelly, Kalyan is deeply in love with Sarika. Under what circumstances did Kalyan turn into CB?",/fLTkTK6ZZJc6PymiQuZDWL14eon.jpg
1673,1095889,[],Sharwa 35,,
1674,1095006,"[53, 80]",Plan B,"The story begins with the demise of a lawyer named Vishwanath and travels through multiple twists, suspense and turns without leaving a single clue for the police to find.",/guFjx5sN6QNeo5qGNP0d4IIMpnY.jpg
1675,1094416,[],AA22,Plot kept under wraps,
1676,1094409,[],AA23,Plot kept under wraps,
1677,1094398,[18],Mother or Wife?,The story of a young man who teaches a lesson to his wife to make her understand the value of a mother's love.,
1678,1093968,[35],Simham Navvindi,"Simham Navvindi is a 1983 Telugu-language comedy film, produced by Nandamuri Harikrishna under the Ramakrishna Cine Studios banner and directed by D. Yoganand. It stars the Chief Minister of Andhra Pradesh, his father, Kala Ranjani and music composed by Chakravarthy.",
1679,1093915,[28],Rowdy Ramudu Konte Krishnudu,"Rowdy Ramudu Konte Krishnudu is a 1980 Indian Telugu-language action film produced by N. T. Rama Rao under his Ramakrishna Cine Studios banner and directed by K. Raghavendra Rao. It stars N. T. Rama Rao, Nandamuri Balakrishna and Sridevi. The music composed by Chakravarthy.",/pmhkpP3ToUuKei1DlMy5B8AjCCY.jpg
1680,1093029,[18],Anthima Theerpu,,/2ZQplXFOpq1rZs9GeT9gnlvNVsv.jpg
1681,1093012,[27],Mangalavaaram,,/zQb8ZU3BEbU7XalrqIv2WLEgwwU.jpg
1682,1092168,"[35, 18]",The Golden Sparrow,"Chandra Mohan is the son of a rich mother (Shanta Kumari) and fun-loving father. His mother asks him to marry, but his father advises him to run away from home and enjoy life. His mother announces rewards for those who find him. He tries to escape all these people. A criminal gang which has an eye on his properties sends one of their female members (Vijaya Nirmala) to attract him. But she falls in love with him. The remaining story is about how they both escape the criminal gang and unite.",/qX6r8iapCPzjSg4FWoYQzvOEkjF.jpg
1683,1090083,[],Swargam Narakam,"The plot revolves around three couples. The first couple is that of Acharya (Dasari Narayana Rao), who always takes advantage of other's mistakes and position and earns money with his wife Mary. The second one is that of an Annapurna (Annapoorna) and playboy Mohan (Mohan Babu), while the jealous and possessive Jaya (Jayalakshmi) and Vikram (Eswara Rao) form the third one.",
1684,1089347,"[10749, 35, 10402, 18]",Love Story 1999,"Krishna is a college student who is constantly rejecting girls who find him attractive. He eventuality falls in love with Meena, the daughter of a powerful woman. Vamsi, a television personality known as Love Boss, is called upon to assist Krishna with wooing Meena, while dealing with love troubles of his own.",/sIxUb5HINcrw37LjU7e41PZsLAe.jpg
1685,1087643,[],America Ammayi,Sridhar is an Indian youth staying in the United States. He marries an American woman Neena and brings her to India. His parents refuse to accept her into their house.,/bPzF0GvF2fZHOg1a2EOieXIQK1r.jpg
1686,1086870,"[10749, 35]",Clouds Of August,A dental student reminisces various episodes in her life.,/2b0GmiTBbReaYtBxhKweVWI2Ppc.jpg
1687,1085752,[],Janata Bar,"Mothers, children, sisters, and ordinary revolutionaries frequently make huge personal sacrifices in the fight for the right to live equally under the law. 'Janata Bar' is the story of one such woman who fought for justice.",/2Zpk5lM4hR6KferfpQ0iqZcTM3o.jpg
1688,1085616,"[10749, 35]",Anandamanandamaye,"While on a train journey, Kiran, an engineer, meets Bhuvana and falls in love with her. Bhuavana's family agrees to their marriage, but mistaken identities lead to the cancellation of the wedding.",/8HdTnvyNEWmT6CsRabewu48uYu.jpg
1689,1080975,"[18, 80, 35]",Rebels of Thupakula Gudem,,/kdfJOebouUxDb6ZRRVdc9kZUmt6.jpg
1690,1080429,[18],Sorry DAD,An emotional story between a motherless child and his father,/4xCigQSwQCvxuGhVnSYbz49IfJi.jpg
1691,1080414,[35],Antharatma 3,Third Installment of Antharatma,/bznrqcZE6nwbKGwaKoGwwAzKaNm.jpg
1692,1080395,"[35, 18]",Antharatma (The Inner Soul),A mockumentary between a person and his inner soul,/miIqpEXKMag0Tv4OPuptwOWouyA.jpg
1693,1080365,"[28, 53]",OG: Original Gangster,,
1694,1080133,"[18, 27]",Trinetram,"Using black magic, an evil spirit tries to harm the husband of a devotee of Goddess Durga. Although she tries many tricks, she finally succumbs to the wife's faith in god and leaves the man unharmed.",
1695,1079595,"[28, 18]",Agni,Shiva works in a company and is in love with the owner's daughter. His boss is a corrupt man who eventually traps and blames Shiva for all the frauds carried out by him and his crooked friends.,
1696,1076732,[],Karan Arjun,Karan and Vrushali go to Rajasthan for their pre-wedding shoot where an anonymous person haunts and traps them. Why did he trap them? What will he do to them?,/bFK2aiWeRs4Q1zQLsyk6JRZoQLg.jpg
1697,1074619,"[28, 18]",Suryapet Junction,A political action drama behind government freebies.,/fKAfX9Zyb1IR6S5HNdg2aq4d36q.jpg
1698,1074601,"[18, 14]",Gunasundari Katha,This is the first Telugu film to complete 100 days of theatrical run in 10 centers. William Shakespeare's play King Lear was the inspiration for the core plot. But the writers changed the tone from the tragedy of King Lear to a more entertaining one for the film.,/5YdV87MUxRigQvSyDRB7g1yXfxx.jpg
1699,1074598,"[36, 18]",Bhakta Potana,"It is a biographical film based on the life of Potana, who translated Bhagavatam into the Telugu language.",/d80BpywrpsmPvnpe8eMQjanIva3.jpg
1700,1074592,"[36, 10751, 18, 10402]",Lava Kusa,"This is the Ramayana story of Seeta (Sriranjani) who retires to the forest and gives birth to twin boys, Lava (Bhimarao) and Kusa (M. Rao). They later take on the might of Rama (Subba Rao) unaware that he is their father.",/uCQsnQiAgPcuIID1twTyK8Ae4GW.jpg
1701,1071154,"[18, 28]",The Blood,,/pGpnP4WPNtQMSzpCbp6wvoeYh3.jpg
1702,1070484,[],The Scene: Take 2,A filmmaker struggles with the actors during the shooting of his film titled LUCHAGALLU.,/xDPT7q8Clz7YnNg5PhIeZELh8Sn.jpg
1703,1069928,"[10749, 35]",Alaa Ninnu Cheri,,
1704,1069884,"[28, 10749]",Untitled PVT04,,/6xziMhOPxJmAURaa0AdMphbzsY1.jpg
1705,1062946,[18],Katha,"After her family gets murdered, Chitra, a lonely girl, spends a year in an asylum. She is petrified when she witnesses another murder and refuses to believe that it is her hallucination.",/aI1UbBFvYSoclZZG65BK3h8hgm4.jpg
1706,1062850,[10751],Athagaru Swagatham,,
1707,1062821,[18],Sira,"Sira meaning ink, depicts the inner turmoil of a writer at ,Conscious, Subconscious and Unconscious levels and his relationship with world, which is again inner and outer.",/lp3M3hDzmyYJkoThT9wmAfISj0D.jpg
1708,1060974,[18],Yerra Mandaram,"Dora kills Ramudu for revolting against the atrocities carried out by him in the village. Later, Ramudu's wife and son kill Dora, and allege the murder was committed by none other than Ramudu.",/taUDWVAZQVhB5JKWsOmmZqv15Qx.jpg
1709,1060932,[18],కళ్ళు,"With the help of an editor, one of the five blind friends has his eyesight restored. Instead of being grateful, he resorts to vicious ways, corrupted by the society and environment around him.",/2ZkDSnMZx8CD39xGeAxMYvf6vMp.jpg
1710,1060135,[18],Maro Prapancham,"Nine idealistic youngsters plan to create ""Maro Prapancham"", an egalitarian utopian. But when they start kidnapping children to bring them into their world, the government appoints Special CBI Officer Ravindra Nath (Akkineni Nageshwar Rao) to investigate the kidnappings.",/sQUL51naCIkKnAuOzTtvTB0PZXE.jpg
1711,1060100,[],Anuragalu,"Anuragalu is a 1975 Indian Telugu film, directed by KS Rami Reddy and produced by T. R. Subramanyam. The film stars Ravikanth and Sridevi in lead roles. Music of the film was composed by Satyam.",/sD5cIoA3wvoSsYPwfJmmF88b4rP.jpg
1712,1060046,"[53, 18]",HIT: The Third Case,,/qIKV0EWSbDmsSMGYQRHO16r95xD.jpg
1713,1057265,[],Ram Charan 16,,/uzH7VeLn1ku0LS23o0jvkEGXVU8.jpg
1714,1054764,[],Sakshi,A young man changes himself into a hard - hearted person after being dejected by the society.,/86vS2GwflNRX0CWki3Kfa9WC4QI.jpg
1715,1053461,"[10749, 53]",Untitled Rakesh Varre-Madhumita film,,
1716,1052300,"[53, 18]",Yevam,,
1717,1052042,"[14, 28, 878]",Adhira,,/3EwOCNHbhC09MeTkCdi8U1rlpoW.jpg
1718,1049434,"[10751, 18]",Chinna Kodalu,"A blind man, his merciless wife, their sheepish sons and stony-hearted daughter torture the eldest daughter-in-law, who is naive. But things change when the youngest son gets married to an orphan. Seeing this, she decides to teach them a lesson and make them mend their ways.",/esSOFfT4oUjB5I6A8kqIeKfNxRc.jpg
1719,1049064,"[53, 9648]",Vaaraahi,,
1720,1048309,"[14, 35, 53]",Maya Petika,,/g1ujQuYNHdw5WX47f5Asw3KHUml.jpg
1721,1045385,[],Miss. Shetty Mr. Polishetty,,/6S4BRlZPfzrludhsPDPVe6fEoxV.jpg
1722,1045306,[],Naga Shaurya 24,,
1723,1045219,[],Amma Deevena,"The protagonist Lakshmamma (Aamani) is a villager. She is married to an irresponsible man, who indulges in drinking and lives life at his will. The couple has five children together. Lakshmamma's husband (Posani Krishnamurali) doesn't help her raise the children. A single lady like her takes the responsibility of the home and starts earning. She works as a daily wage laborer in a quarry, as a worker at a flour mill, and starts supporting the family. The family gets into deep financial stress as the head of the family doesn't provide for them. She still manages to pull the family together with her earnings.",/hPmBZufncQfeo7u8z6h3Ms36DBP.jpg
1724,1045069,[],Pratibimbalu,,
1725,1042573,"[80, 53]",Nirbandham,The movie delves into the psychology of rapists while also depicting the heart wrenching darker aspects brought out by the lockdown during coronavirus pandemic.,/vDdfnGn9hv1f52Z9lJ3FIjcgm8h.jpg
1726,1042382,"[10749, 35, 18]",Abhiram,,/1GpJScZuCVfNWn3xHMDYP6Ln3X3.jpg
1727,1040718,"[28, 80, 18]",Harom Hara,,/f023tEDQ1eOqPMrVO1vjOVj358f.jpg
1728,1040658,"[10749, 35]",Maate Mantramu,,/3vzjPed6iPrrqQSOqPE5DceD82W.jpg
1729,1040624,"[10749, 35]",Umapathi,,/beHuAxgMpqsdDdcH1j8IpaggZhh.jpg
1730,1040591,"[53, 80]",Focus,"Police SP Vivek Varma, husband of Judge Pramodha Devi, gets murdered at a guest house. The investigating officer S.I. Vijay Shankar  takes up the case and suspects it to be a possible homicide. Will Vijay and Pramodha Devi be able to track the criminal(s)?",/nLIa276c5nTIGdKuwMrDZruQETA.jpg
1731,1039985,[],Poles Apart,"An ambitious filmmaker meets a picky editor to hire him for his film, through a mutual friend. They make great films individually but their interests are poles apart. It's all a question of how they will collaborate.",
1732,1039482,"[35, 53, 80]",(Tillu)²,,/bdzi5up1CnAyeAyptLoIq5HiHJn.jpg
1733,1038479,"[18, 36]",Kavisamrat,Biography of Viswandha Satyanarayna. A Telugu Poet who ruled telugu literary world for five decades from 1920 to 1970,/kkfEgGLtgTW1wxGNT2eEr3l0TG2.jpg
1734,1037209,"[18, 53]",Ari: My Name is Nobody,,/f3Edpcvkw1WfN0eC3clXIqtW4fm.jpg
1735,1036785,"[35, 10749, 28]",Bomma Blockbuster,"Pothuraju is a fisherman, film freak & ardent fan of Director Puri Jagannath. His life ambition is to conjure up the dramatic moments in his life & persuade his idol Puri Jagannath to make a film based on him. As time passes, he discovers life-altering secrets about his own family and life. Thus, Pothuraju will get forced to confront the deep pain behind his ludicrous antics and a simplistic worldview.",/4bYCtlGKQS8mngbNUPa0zslcRzY.jpg
1736,1035998,"[53, 80, 18]",Zebra,,/uwu1WsdWvUldeIOgA6ge51QhrKZ.jpg
1737,1034882,"[53, 80]",Atharva,,/9hOWqupHmcs2YkKO30ccWXOxrE3.jpg
1738,1034158,"[28, 10752]",Varun Tej 13,,/gu3YYGrbUJ5O4SUW0VOymI4TJDP.jpg
1739,1034155,"[28, 53]",Gandeevadhari Arjuna,,
1740,1033211,"[35, 10402, 18]",Endless Money,"Shyam, an artist, lives with Rama. They have a lavish lifestyle and run from the people they're indebted to until Shyam meets Saroja, an admirer of his work and they fall in love. Saroja's father gives Shyam a lot of money to spend. What does Shyam end up doing with all that money?",/jq5WjgChy05ZBJlcXDGPJePIjsk.jpg
1741,1032240,"[10749, 35, 10751]",Jilebi,,
1742,1031983,"[35, 10749, 28]",Ustaad,,/4XXXBmX16q9EwN8iNXnBMPgY8as.jpg
1743,1031973,"[28, 10749]",RAPO20,,
1744,1031218,"[35, 18]",Samajavaragamana,,
1745,1030060,"[53, 9648]",Sabari,,/iAqslpL9D2yfi6o7cAMtTytlGdj.jpg
1746,1029671,"[10749, 35, 28]",Janakiram,,/oiZhnCeOMIs3WDxoPcTljRDHEP4.jpg
1747,1029517,[],Uuuggghhh,"The film is an abstract take on 'Desire.' The film director uses many metaphors to narrate the story, which evokes a wide range of emotions.",/jof4NtebcGEBl82xVPrItyHJO78.jpg
1748,1029466,[],OTP,,
1749,1029449,"[10749, 35, 18]",Vidya Vasula Aham,,/kfTPXfmtLyViTtU1nD6OAq39s0n.jpg
1750,1028750,"[18, 35]",Kishore Kumar,Kishore and Kumar's hunt for pot during a wet and stormy monsoon downpour in Hyderabad.,
1751,1027248,[],Raksha Rekha,"The film begins with Kalavathi, the only daughter of Simhala King Rajasimha, who is averse to marriage. So was Sudhakara, son of King Parthapa of Avanthi. Unable to convince him to get married, King Parthapa keeps him, along with a servant Dooradarsi, in a dilapidated house in the forest.",/mcSS2FUShAM1B9ALypSYrXVl6q3.jpg
1752,1026439,[18],Double Engine,"Ambitious auto rickshaw driver Danny is lured into the black market of superstition, in search of a  non poisonous two-headed snake, locally referred with the secret code ‘double engine'.",/taHsoY1PdjVJikYCL0yRRGUKZp5.jpg
1753,1026159,[10749],Nenu Pelliki Ready,"Pressurized into getting married, Gopi selects three prospective brides from a marriage bureau. In order to get rid of them, he gets engaged to Priya, the owner of the bureau.",/gRYZgMy7b3kvn49SYiC84FQxuyI.jpg
1754,1025575,[],Patrolling,"On a sunny day, Two guys go to the village outskirts to smoke peacefully and get interrupted by two brutal policemen. This interruption leads them to a tragedy.",/pouMrPN1woRTxXMycT4Dg7m9WZv.jpg
1755,1024935,"[10749, 53]",Preminche Manasu,A spoilt man falls in love with a woman he sees at first sight and woos her using his friend's name. But he gets possessive of her and goes to great lengths to hide the truth from her.,/xbBLW4rBB07e3ztXAv8dM23Bi9P.jpg
1756,1024825,[35],Tirumala Tirupati Venkatesa,Three sisters are obsessed with money and dream to marry wealthy grooms. They marry three prospective grooms but later learn that they are ordinary people and refuse to live with them.,/ypEZs0qeRbNHRZszf26UEd1OxUt.jpg
1757,1024824,[28],Chiranjeevulu,"While running away from the police, Charan, Giri, Chanti and Kiran reach a village where they face many problems. They get embroiled in a fight against Satyamurthy, a cruel village head.",/hFQ4dxlM6cabW8OlFOzCN5EH239.jpg
1758,1024708,[],Pawan Kalyan & Surender Reddy,,
1759,1022915,[],Punarjanma,"Gopi, a sculptor who is in love with his niece, goes into a delirium after his sculpture catches fire. His troubled father tries various things to help him get back to his feet.",/om3dopxbXCM4HVUfmbr05Nbdrtr.jpg
1760,1022684,[18],President Gari Pellam,"Swapna pretends to be Raja's lover to humiliate him in front of the villagers. In retaliation, Raja challenges her father and stands opposite him to become the next village chief.",/Ryq1koV7Na1mkkJq9UNVEnz0Cw.jpg
1761,1022453,"[27, 35]",Raja Deluxe,,
1762,1022263,[],Pellamto Panenti,"Madhu rejects the advances of a few women because he does not believe in love. However, his life takes a turn when he discovers that Kalyani, a girl who loves him, is suffering from a fatal illness.",/avBYwq1JZ9s5AdZAuzAOTv0wHv4.jpg
1763,1022153,[18],Madhu Babu,A night in the life of a taxi driver named Madhu Babu.,/6gm3Nn4bClPrhGiYk84tnNWXUIr.jpg
1764,1022110,[10749],Preminchedi Endukamma,"Sunil (Anil) is a carefree college student. Swapna (Maheswari) is his classmate. Sunil loves Swapna and vice versa. Jagan (PrakashRaj) is the father and the only parent of Swapna, who is obsessed with the well-being of his beloved daughter. Sunil and Jagan have a few showdowns. Jagan do not like the attitude of Sunil. When Swapna confides Jagan that she is in love, he is visibly delighted. His excitement becomes a short-lived one as he realizes later that his daughter's choice is none but the cockish Sunil.",/5i2D9fFXvy3gzrh2XMZ2KdnpuY3.jpg
1765,1022056,"[28, 10749]",Ravana Kalyanam,,
1766,1021902,[],Mr & Mrs Sailaja Krishnamurthy,"Krishna, an atheist, visits the Annavaram temple where he meets Sailaja, an extremely religious woman. Circumstances force them to pretend to be a married couple and while doing so, they fall in love.",/5YxPNCvjx9PVASt8Bi1QQhsymkw.jpg
1767,1021898,"[10749, 35]",Oka Raju Oka Rani,"Ravi loves Preethi and wants to marry her but her father hates such unions due to her sister's failed love marriage. In an attempt to be with each other, they both plan to cheat her father.",/332qnUiiCidHmINKcxOnp2lieLX.jpg
1768,1017675,[18],Chal Mohana Ranga,,
1769,1017636,"[10749, 10402]",Swara Kalpana,,/9SWjfdx5wmCT7YprHztNkoSPd9I.jpg
1770,1016647,"[27, 53]",Danger,"A gang of friends is on a trip, three guys and three girls. Highly enthusiastic and overflowing energy. They lose their way and end up in a forest. The driver loses control and hits a tree. They have to spend the night in a cabin in that forest. They decide to allow the night to pass and see if they can survive the hidden, unknown perils around them. But do they survive the ordeal? Do they return unscathed? How many of them remain alive?",/dSfCNMJtmNeHl6sanJhu4B3XWVs.jpg
1771,1016631,"[28, 53]",Aranyamlo,"Aranyamlo is a romantic action thriller written, directed and produced by Sudershan Reddy Palvai under One Man Creations banner while Ajay Patnaik scored music for this movie.",/8qXR4OsRFBroPeqXqkmHoqZvbsr.jpg
1772,1013652,[],Muthayya,"In a remote village, a 70-year-old man dreams of becoming an actor before he dies. While sharing these dreams with his best friend, he tries to showcase his acting skills in every way possible.",/zLSRAqCLUJY8hB1UmYdBLvfK0Me.jpg
1773,1012122,[18],Manavarali Pelli,"A girl comes to her grandmother's home to study when she notices a bright and handsome student. Thereafter, their respective grandparents try to bring them two together.",
1774,1009916,[],Aakasa Ramanna,"Aakasa Ramanna is a Telugu-language film starring Kanta Rao and Rajashree in lead roles. The film was released in the year 1965 and has been directed by G. Viswanathan. Producer of the film is S. Bhavan Narayana. Watch the full movie Aakasa Ramanna online, only on Eros Now.",/l3lCHUn0zWrDIWNQUaD6EP69BoG.jpg
1775,1009712,"[10749, 35]",Moodu Mukkalaata,"Three girls, Shravani, Lahari and Aliveni, are in love with Shanti Swaroop, a lecturer. His life takes a turn when these girls execute different ways to woo him.",
1776,1007494,[18],Thalambralu,"This is a ritual of happiness turned into a tragedy, this is a ritual of lies and deceit for our young protagonist, will she sink down or rise up from this situation?",
1777,1006780,"[80, 53, 18]",Agni Nakshathram,,/z3hsuvJJdokjTlm28wcELuFDjdC.jpg
1778,1006175,[],Vaade Veedu,VaadeVeedu is a most Romantic suspense thriller film. Series of unfortunate events occur when a husband is deceived by his wife. His only mistake was to trust and love her passionately.,/kZ4aKaHSqDUHzlPLVQlPGptk8My.jpg
1779,1001632,[28],Krishnamma,,/9DlAaAJC0hMDWfNJVpFmjCkwhly.jpg
1780,1001279,[],Rules Ranjann,,/eXhCZerJvw2kXEbXor0DSWd7aa2.jpg
1781,999043,[],PORTRAIT.,"A portrait of man dealing with himself on a rainy day. Part realistic, part expressionist.",/2mFlxqeVCPK8zh1CJomWsEYZagm.jpg
1782,997945,"[80, 18]",Manasaakshi,"Manasaakshi (transl. Conscience) is a 1977 Indian Telugu-language social film, directed by Parvataneni Sambasiva Rao. It stars Krishna Ghattamaneni, Bharathi Rao, Kongara Jaggayya, Kantha Rao, and Sowcar Janaki, with music composed by J.V. Raghavulu.",/mGBL1qvYkEQiL7qNvOZ8iWT0N0F.jpg
1783,997899,"[28, 18]",Jagath Kantrilu,"Jagath Kantrilu is a secret research black and white Telugu film released on April 3, 1971. Produced by P. A. Kamreswara Rao under the banner of Phalguna Productions, P. Lakshmi Deepak directs the film. Starring Sobhan Babu and Vanisri in the lead roles, the film has music by S. P. Kodandapani. Moondrejuthu (1968), a Tamil film starring Jayalalitha and Ravichandran, was translated into Telugu as Jagath Kantrilu and released.",/32xhRgnRYvDn2KOOz3bGniPhSg5.jpg
1784,997867,"[28, 18, 36]",Errakota Veerudu,"Errakota Veerudu is a Telugu film released in 1973. Produced by T Gopalakrishna under the banner of TGK Films, MSP Sarathy directed the film. Nandamuri Taraka Rama Rao and Savitri are playing the lead roles in the film, which has music by Ghantasala Vijayakumar.",/jAn9Dsr8yng4SZObIfU6XFHe96J.jpg
1785,997854,"[28, 12, 14]",Daiva Balam,"Daiva Balam (transl. God's Grace) is a 1959 Telugu-language swashbuckler film, produced and directed by Ponnaluru Vasanthakumar Reddy. It stars N. T. Rama Rao and Jayasri, with music composed by Ashwatthama. The film is the debut of Shobhan Babu in the film industry. The film is known to be one of the earliest Telugu film containing sequences in Eastman color.",/r8j4XPAyqIOxWtYSBCGmffTFX1z.jpg
1786,997841,"[28, 18]",Desa Drohulu,"Desa Drohulu (transl. Traitors) is a 1964 Indian Telugu-language action-drama film, produced and directed by Bolla Subba Rao under the Sri Rama Pictures banner. It stars N. T. Rama Rao, Devika, Kanta Rao, and music composed by S. Rajeswara Rao.",/5HqckJ7GJqp2UyYvbEDugqPtHIa.jpg
1787,996002,[18],Bangaru Chellelu,,
